Source,Title,URL
Reuters,"Meta Fact-Checking Rollback Amid Political Pressure",https://www.reuters.com/technology/meta-rolls-back-fact-checking-2023-05-01
The New York Times,"Reinstatement of Trump’s Social Media Accounts Sparks Debate",https://www.nytimes.com/2023/05/02/us/trump-social-media-reinstatement.html
Politico,"Trump Returns: Social Media Reinstates Controversial Account",https://www.politico.com/news/2023/05/03/trump-social-media-return-001234
The Washington Post,"Meta’s Policy Shift: Why Fact-Checking Is Taking a Backseat",https://www.washingtonpost.com/tech/meta-policy-shift-fact-checking-2023/05/04
CNN,"Trump's Social Media Comeback: What It Means for Politics",https://www.cnn.com/2023/05/05/politics/trump-social-media-comeback
Bloomberg,"Meta Rethinks Fact-Checking: Implications for Political Discourse",https://www.bloomberg.com/news/articles/2023-05-06/meta-fact-checking-roll-back
BBC News (US/Canada),"Trump Reinstated on Major Social Platforms amid Controversy",https://www.bbc.com/news/world-us-canada-6567890
Los Angeles Times,"Social Media Shake-Up: Trump's Return and Meta's Policy Revisions",https://www.latimes.com/tech/story/2023-05-07/trump-return-meta-policy
Associated Press,"Updates on Trump's Reinstatement and Fact-Checking Rollback",https://apnews.com/article/trump-reinstatement-meta-fact-checking-2023
CNBC,"Backlash and Support: Meta’s Fact-Checking Changes Under Scrutiny",https://www.cnbc.com/2023/05/08/meta-fact-checking-policy-change
NPR,"Politics and Platforms: Analyzing Trump’s Social Media Reinstatement",https://www.npr.org/2023/05/09/trump-social-media-debate
Wired,"Inside Meta’s Decision to Reverse Its Fact-Checking Stance",https://www.wired.com/story/meta-reverses-fact-checking-2023
Vox,"Trump and Tech: What the Recent Reinstatements Reveal About Digital Politics",https://www.vox.com/2023/05/10/trump-digital-policy
TechCrunch,"Meta’s Pivot Away From Automated Fact-Checking: A Closer Look",https://techcrunch.com/2023/05/11/meta-fact-checking-pivot
The Hill,"Trump’s Social Media Return: A New Era for Political Discourse?",https://thehill.com/opinion/technology/2023/05/12/trump-social-media-return
Taiwan News,"Digital Intermediary Services Act Debate Intensifies in Taiwan",https://www.taiwannews.com.tw/en/news/2023/05/13/digital-intermediary-debate
Focus Taiwan,"Taiwan Legislators Clash Over Proposed DISA Regulations",https://focustaiwan.tw/society/2023/05/digital-intermediary-regulation-debate
Taipei Times,"Tech Policy in the Spotlight: Taiwan’s DISA Proposal Under Fire",https://www.taipeitimes.com/News/taiwan/archives/2023/05/14/digital-intermediary-act
Central News Agency (Taiwan),"Taiwan Debate: Digital Intermediary Services Act and Its Impacts",https://www.cna.com.tw/news/20230515/disa-debate
Reuters Asia,"Taiwan’s Proposed DISA: Balancing Innovation and Regulation",https://www.reuters.com/world/asia-pacific/taiwans-digital-intermediary-debate-2023-05-16
BBC News Asia,"Debate Over Taiwan’s New Digital Services Law Heats Up",https://www.bbc.com/news/world-asia-6567891
The Straits Times,"Taiwan's DISA Proposal: Navigating Tech Regulation in a Digital Age",https://www.straitstimes.com/asia/east-asia/taiwan-digital-act-debate
Nikkei Asia,"Regulating Online Platforms: Taiwan’s Digital Intermediary Services Act",https://asia.nikkei.com/Politics/Taiwan-Digital-Intermediary-Act
Al Jazeera,"Taiwan's Tech Law Battle: The Case of the Digital Intermediary Services Act",https://www.aljazeera.com/news/2023/05/taiwan-digital-intermediary-services-act
The Diplomat,"Understanding Taiwan’s Digital Intermediary Services Act and Its Controversies",https://thediplomat.com/2023/05/taiwan-digital-act-controversy
Asia Times,"Tech Debates in Taiwan: The Proposed DISA and Its Implications",https://asiatimes.com/2023/05/taiwan-disa-debate
Global Times,"Taiwan’s Digital Future: Deep Dive into the DISA Debate",https://www.globaltimes.cn/2023/05/taiwan-disadebate
Channel News Asia,"Taiwan’s Legislative Tug-of-War Over Digital Services Act",https://www.channelnewsasia.com/news/asia/taiwan-disadebate-2023-05
TechNode,"DISA and the Digital Landscape in Taiwan: A Closer Look",https://technode.com/2023/05/taiwan-digital-intermediary-services-act
Reuters (Alternate Coverage),"Evolving Digital Regulation: Taiwan’s DISA Proposal Meets Mixed Reactions",https://www.reuters.com/world/asia-pacific/taiwan-disa-proposal-2023-05-20
