author,text,likes,published_at
@nuridasari2080,suara ten bagus banget,4,2023-03-26T14:18:37Z
@kanayomaria885,SO10 soon,5,2023-03-26T14:17:59Z
@nuridasari2080,"semoga kedepannya, ten lebih banyak cover lagu thai ❤",5,2023-03-26T14:17:54Z
@kanayomaria885,Ten is the main vocalist that you are,11,2023-03-26T14:17:45Z
@nuridasari2080,ten lee best of the best,6,2023-03-26T14:17:28Z
@kanayomaria885,Ten Lee is the best,5,2023-03-26T14:17:24Z
@nuridasari2080,Ten lee honey voice ❤,8,2023-03-26T14:17:14Z
@flukefikk,เก่งมากๆเลยย💚😭,0,2023-03-26T14:16:57Z
@newsky8286,❤️,1,2023-03-26T14:16:47Z
@munafitrinabilah2508,sayang banget sama merekaaa❤❤❤❤❤❤❤❤❤❤❤❤❤❤❤❤,0,2023-03-26T14:16:17Z
@munafitrinabilah2508,vocalnya emang ga main main❤❤❤❤❤❤❤❤❤❤,0,2023-03-26T14:16:01Z
@c0ldeu,I can’t believe my ears that Xiaojun sang my fav thai song 🥹,2,2023-03-26T14:15:53Z
@yuzupiters,melenyot mendengar suara xiaojun mana ni lagu juga pernah jadi lagu favorit aku tahun lalu,0,2023-03-26T14:15:17Z
@sucirachmadani7952,Beda bgt damage nya Ten pake bahasa Thai. Suaranya jdi trdengar lebihhhhh bagus,3,2023-03-26T14:10:43Z
@arreeyamankaen2837,ร้องเพราะมากกกเลยยยย 🫶🏻💚,0,2023-03-26T14:10:17Z
@woshekannika,เตนล์ คือเสียงงงเว่อมากกก หูเป็นสีทองแล้ว,5,2023-03-26T14:09:27Z
@aurak.2169,😍😍✨,1,2023-03-26T14:09:25Z
@sucirachmadani7952,Kun Ge 🥹,0,2023-03-26T14:06:56Z
@sucirachmadani7952,Dejun we suaramu bikin melting,0,2023-03-26T14:06:43Z
@sucirachmadani7952,Tennnnn ku 😍,6,2023-03-26T14:06:30Z
@jajamene,Ten's singing in Thai!!! His voice is so wonderful. The best. Thumb up. You did a great job. Some other Thai artists also want you to cover their songs too.,43,2023-03-26T14:05:29Z
@afrofelfel5539,I have known of TEN since Hit The Stage and to see how much he's grown as an artist is amazing. Cannot wait for his solo ALBUM and hope SM will give him a proper promotion! Love Wayv's vocal line too 💥,170,2023-03-26T14:01:54Z
@Mamawhereismyphone,น้องเตนของแม่🥹🥹🥺🥺🥺🥺🥺🥺🥺🥺🥺🥺❤️❤️❤️🫶🏻🫶🏻🫶🏻🫶🏻🫶🏻🫶🏻,2,2023-03-26T14:01:13Z
@ไอโบ้-ต7ญ,อมก มากค่ะ,0,2023-03-26T13:54:56Z
@brrrrrrbb2906,กี้ดดดดดดดดดดดดด,0,2023-03-26T13:54:28Z
@brrrrrrbb2906,กี้สสสสสสสสสสสส,0,2023-03-26T13:54:15Z
@impallee3312,เลิกฟังไม่ได้,0,2023-03-26T13:54:03Z
@risnanana2770,Kalau ke indo mau cover lagu indo gak yahh,0,2023-03-26T13:50:43Z
@kamonnitchaemsuea1623,OMG!!! MV ดีมากให้ฟีลแอบชอบลูกชายร้านผัดไท เสียงน้องๆแต่ละคนดีมากฟังแล้วใจฟู เต๋อคือร้องชัดมาก น้องเตนล์เสียงหวานมากเลยค้าบ คุณเกอก็เก่งมากที่ทำให้เพลงนี้ออกมาสมบูรณ์แบบ ขอให้น้องๆได้มีโอกาสร้องเพลงไทยเยอะๆนะค้าบบบบ,1,2023-03-26T13:50:26Z
@paweenaji4838,แฟนเราเก่งจัง,0,2023-03-26T13:49:32Z
@jennyjenny1197,ขอโทษที่มองเซ็ทเป็นซุ้มยาดองแทนร้านอาหาร😅,1,2023-03-26T13:44:44Z
@Parkjisung1205,😢😭🤧 oh my dejun highnote,0,2023-03-26T13:42:42Z
@nicamansog4463,"Wooow. Love you Kun, Xiaojun and Ten. I was so sad that I cannot attend the fan meeting here in Manila.",1,2023-03-26T13:42:31Z
@TEN4TENLEE,"KUN TEN XIAOJUN, they are all amazing ^^
น่ารักกันทุกคนเลย เสียงดี ละมุนละไม
เต๋อ ใส่เสื้อ 3 ชั้นเลยหรออ ฉากเปิดตัวอย่างน่ารัก
เตนล์ ยิ้มหวานสุด สบตาละแทบตายยจริง
คุนเกออ ขอบคุณสำหรับ arrange น้าาา รอสนับสนุนต่อไป",3,2023-03-26T13:40:42Z
@RomanticJae,โคตรดีเลยอ่า,1,2023-03-26T13:39:22Z
@asmidaabdul3179,Love this cover sooo muchhhh 😍,0,2023-03-26T13:39:15Z
@33sinenadluecha63,โอ้ย หวานหยดย้อย,1,2023-03-26T13:39:01Z
@yuyuiworapat1367,SO SO GOOD❤,1,2023-03-26T13:37:58Z
@fabianepufal1441,"Vai Kun, pode derreter meu coração",1,2023-03-26T13:31:12Z
@leemike3904,love,0,2023-03-26T13:30:33Z
@prawpp9047,เจอรอยยิ้มน้องเตนล์ก็ไปไหนไม่ได้แล้ว,4,2023-03-26T13:30:26Z
@kpopsweetlemon1396,omg the harmony at the start wow. amazing cover.,1,2023-03-26T13:29:26Z
@purplexuy9933,😭💖😭💖😭💖,0,2023-03-26T13:29:22Z
@crystallee3595,"Their voices are so beautiful, as always! It’s great to hear Ten singing in Thai!❤",53,2023-03-26T13:24:32Z
@palitasatsit5347,❤❤❤❤❤❤❤❤❤❤,0,2023-03-26T13:20:45Z
@วาสนาอยู่สถิตย์-ฆ5ฝ,แงงงงน่ารัก เพราะมากเลย โต๊ะริม~~~ น้องคุนกับเซียวจวินร้องไทยชัดมากเลย,0,2023-03-26T13:20:37Z
@camma5909,เขินมาก!!! โต๊ะริมก็โรแมนติกเหมือนกันนะเนี้ย,0,2023-03-26T13:20:17Z
@farreltatariti1483,ถ้าเราเต้นไม่ได้ทำไง งั้นเราต้องร้องให้ได้ เตนล์เก่งมากเลยขยันพัฒนาตัวเอง,8,2023-03-26T13:13:49Z
@สมัญญาอยู่มั่นธรรมา,ใจละลาย❤❤❤,1,2023-03-26T13:13:22Z
@bigmommyjanaa4065,XIAOJUN KING U KEEP SLAYINGGG,5,2023-03-26T13:12:54Z
@thanavann.6409,ขอบคุณที่สานฝัน ไม่คิดว่าจะมาร้องเพลงฉบับเต็มคือตอนที่พี่ๆร้องในคอนก็ดีใจจะตายแล้ว พอมาทำฉบับเต็มคือหนูตายแล้วตายอีก แล้วก็เสียงเตนล์หวานมากส่วนพี่เต๋อร้องดีมากร้องเพราะมากสำเนียงดีมากส่วนพี่คุนคือดีแล้วดีตัวพ่อตัวบิดามารดาสุดๆ,0,2023-03-26T13:12:43Z
@bigmommyjanaa4065,KUN MASTERFUL TRULY,3,2023-03-26T13:12:39Z
@bigmommyjanaa4065,TENNNNNNN GOORJIUSSSSS,6,2023-03-26T13:12:27Z
@Imphitchyy,德俊， 你是个泰国人,0,2023-03-26T13:12:18Z
@bigmommyjanaa4065,NEED MORE COVERS,2,2023-03-26T13:12:08Z
@rainisnamept2028,Tenlee is the best ❤,7,2023-03-26T13:11:49Z
@tajirunko2225,หยุดฟังไม่ได้เลยยยย อยากยกเก้าอี้ไปนั่งฟังตรงนั้นที่ยังเหลือ😍😍😍,0,2023-03-26T13:10:21Z
@thanavann.6409,ไม่ต้องสาปก็ละลายแล้วค่ะ,0,2023-03-26T13:10:01Z
@hoangyenpham1263,á xiaojun đz wa'''''''''''''',1,2023-03-26T13:05:47Z
@minkoo106,SOO GOOD !!!!!,0,2023-03-26T13:01:13Z
@kumikodor,너무 좋아!!다들 목소리가 예뻐!!!,1,2023-03-26T13:00:32Z
@stxvz24,เสี่ยวจุนนนนนนนน,0,2023-03-26T12:59:43Z
@stxvz24,เสี่ยวจุนนนนนนนน,0,2023-03-26T12:59:21Z
@stxvz24,อุ๊ย เขยไทยตั่วหนิ,0,2023-03-26T12:59:03Z
@nadeeyayateng7997,เลิศ👏👏👏,0,2023-03-26T12:58:47Z
@sherrychine,ทำไงดี ฟังไม่หยุดเลย,0,2023-03-26T12:56:33Z
@MagicTasty,🥰,0,2023-03-26T12:56:27Z
@THGuildboy,หูเคลือบทองคำ,0,2023-03-26T12:52:17Z
@kwangkmon944,เฉลยยังว่าwayv เป็นยูนิตไทย😂,0,2023-03-26T12:50:15Z
@whereychopper1329,เตนร้องเพลงไทยชัดมากครับ 😂😂😂,1,2023-03-26T12:44:58Z
@haruharu2052,เต๋อร้องเพลงไทยชัดมากกกก,0,2023-03-26T12:42:15Z
@Moo2newz,เตนล์กับเพลงไทย คือมันดีมากกกกก,5,2023-03-26T12:37:07Z
@mr_chujm,น้องเสื้อเชิ๊ตชื่ออะไรคะ ร้องชัดมากกกก โอ้โห นี่ไม่เคยฟังเพลงเต็มเลย มาฟังตอนนี้แหละ เอาเรื่อง เพราะมาก ดี ดี ดีมาก,0,2023-03-26T12:35:52Z
@penqueen7843,3 mük vokal,0,2023-03-26T12:35:25Z
@emilyavelinoruiz4248,Tenho certeza que é isso que se escuta quando chega no céu,0,2023-03-26T12:35:06Z
@mmodeiei,🫶🏻💞,0,2023-03-26T12:32:11Z
@kuropingguo,Heavenly vocals!!! Thanks Kun ge for arranging this masterpiece ♥️♥️ WayV should have Thai songs in their album cos damnn,15,2023-03-26T12:29:13Z
@Abcdefghijk964,อยากไปนั่งกินหอยทอดใกล้ๆเธอ❤️❤️😆😆,1,2023-03-26T12:28:49Z
@gooddaywithme7986,เก่งกันทุกคนเลยย,0,2023-03-26T12:27:49Z
@shu2bie-pd2wh,แสนจาเพราะ คือดีมากๆ ทั้งเสียง มู้ดโทน ลุคต่างๆ เสียงสามคนประสานกันคือที่สุดดด,2,2023-03-26T12:24:51Z
@daralight6932,เสียงเตนล์คือที่สุดที่ใจ ละลายหมดแล้ววว😭😭😭,8,2023-03-26T12:24:35Z
@ファ-c3m,ดีมากดีสุดๆ ทุกคนเก่งมากโอรร,0,2023-03-26T12:23:28Z
@priyalilin3709,อหหห นี่คือเพลง coverที่ไพเราะที่สุดในโลก ตตเกิดมาไม่เคยฟังอะไรที่เพราะขนาดนี้เลยแม่เจ้าโว้ยยยยย,0,2023-03-26T12:20:23Z
@arsyifapalantaran721,"yasss, stan WayV for better life guys",0,2023-03-26T12:19:16Z
@mimislil.j,กี้ดดดดดดดดดดดดดดด,0,2023-03-26T12:17:58Z
@DaranyYeah,ขอ WayV บั้มเพลงไทยค่ะ เดไทยสัก 1 กรุบ 🎉,1,2023-03-26T12:12:13Z
@howhi9309,ฉันโดนสาปค่ะ ตายแล้วตายอีกกกกฮือออออออออออ,1,2023-03-26T12:09:57Z
@Bhoooooomi,"Waachh covernya g kaleng2, ❤❤",0,2023-03-26T12:04:53Z
@เพื่อเธอได้ทุกอย่าง,ดีมากค่ะ มันดีมากค่ะ,0,2023-03-26T11:59:39Z
@ahctihppoy,น้องเตนล์น่ารักมากเสียงก็ใสกริ๊งเยย❤❤,3,2023-03-26T11:58:58Z
@reik0u534,ทำให้ละลายของจีงงงงง,0,2023-03-26T11:55:49Z
@piyawadeenawasimainam7265,อยากบอกว่าเป็นบุญหูมากๆค่ะ🎉🎉🎉,0,2023-03-26T11:54:06Z
@chikanataliaofficial7236,Killing voice from Ten Xiajun and Kun ❤️🔥,5,2023-03-26T11:53:25Z
@Shiakii,หูเคลือบทองละค่า❤,0,2023-03-26T11:49:02Z
@siegrreiich,wayv vocal line never miss 😭,3,2023-03-26T11:48:18Z
@Ggggk0,ร้องดีทั้งสามเลยยยยยยยยย💓💞💞💗,0,2023-03-26T11:42:11Z
@chucugibe8099,ตายระชั้นโดนน้องเตนล์สาป😭😭😭,2,2023-03-26T11:41:43Z
@mnn.267,เพราะสุด ดีสุด เริสๆ10/10,0,2023-03-26T11:41:36Z
@miyuki.s9478,"と〜っても素敵な曲🎶
心地よくてズッて聴いてる😊

クンさんのArrange✨✨✨",2,2023-03-26T11:41:00Z
@mado0522,最高のmv、本当に本当にありがとう😢❤バンコクのペンミでぜひ披露してください💞！,0,2023-03-26T11:38:00Z
@minaawa,Ten 😭,5,2023-03-26T11:35:39Z
@chevast1lanna,ละมุนมาก version นี้^^,0,2023-03-26T11:34:30Z
@keila2948,god I love them so much,0,2023-03-26T11:31:16Z
@ji_jiwoongggg,💚💚💚,0,2023-03-26T11:21:47Z
@m.8426,เซียวจวิ้นเป็นคนไทยรึป่าว ร้องชัดมากกกก55555 เสียงหวานละมุนสุด เก่งมากคับ🫶🏻🫶🏻,0,2023-03-26T11:19:56Z
@phongsriyimyam4744,เพราะครับ❤,0,2023-03-26T11:19:41Z
@epttt,น่ารักมากกกกๆ 🥺🥺💗💗,0,2023-03-26T11:12:09Z
@sellylovejin6675,ร้องเพราะมากค่ะ เสียงดีทุกคนเลย🥰🥰,0,2023-03-26T11:11:31Z
@ariyapor10vely58,มาแรง8,0,2023-03-26T11:09:55Z
@gerzerteran,"I love KUN, TEN and XIAOJUN",3,2023-03-26T11:07:13Z
@nuengsongwoot,ตายแล้วตายยยย กุตายยยย,0,2023-03-26T11:06:10Z
@นัฐกานต์แก้วเกิดมี,เพราะมากเลย❤,0,2023-03-26T11:02:02Z
@skyblue9591,I'm melting🫠,0,2023-03-26T11:01:23Z
@ศุภวรรณโพธิ์โพ้น,"งื้อๆๆๆเพราะมากกกก ละลายหมดแล้วววว พี่KUN กะพี่ XIAOJUN ร้องชัดมาก 
I LOVE YOU 💚💚",0,2023-03-26T10:59:38Z
@user-xg5uk6nx6p,I want to say Ramadan Kareem 💚,1,2023-03-26T10:58:55Z
@ณัฐฌาศรีสําราญ,ดีมาก เพราะมาก เก่งมากๆทุกคนเลย TT,0,2023-03-26T10:58:30Z
@meowjen,โอ้ยยยยยยหวานกว่าน้ำผึ้งอีกค่ะพี่ๆ🥺🫶🏻 เพราะมากกกก ความพิเศษดนตรีนี้เนาะคนละภาษาแต่สื่อสารเข้าใจกันยิ่งกว่า😭💖👍🏻,1,2023-03-26T10:58:24Z
@mugi52650,Who can resist those voices wow big thumbs to ten and his team.,9,2023-03-26T10:56:47Z
@anggaparwati4130,Ditunggu cover lagu Indonesia nya bang,0,2023-03-26T10:53:31Z
@_imyouricen,3คนเก่งมากกกกกน้ำตาลเคลือบหูแล้ว ร้องชัดมากจริงๆ,7,2023-03-26T10:52:26Z
@Sunghyejin,เสียงเตนล์หวานจนจะละลายจริงๆอะ,5,2023-03-26T10:49:49Z
@unilove5571,"Ten's voice is so beautiful, it makes me melt",342,2023-03-26T10:46:56Z
@imnotgoodpers,เซียวจวิ้นร้องไทยชัดมากกก,1,2023-03-26T10:46:28Z
@uthitardan2313,Baguuussss ❤❤❤❤❤,0,2023-03-26T10:46:13Z
@wineangoon5763,ตายแล้วววว ดูไปเขินไป 💗 MV ดูละมุนมาก ร้องเพราะและน้องๆ ร้องภาษาไทยชัดมาก like like like เลยค่ะ 👍🏼😊,5,2023-03-26T10:45:19Z
@Kittiya-jp9fm,หลงรักรอบที่ล้าน❤❤❤❤,1,2023-03-26T10:44:46Z
@spoorthivraj9411,"I appreciate kun and xiaojun so much for singing in Thai and sound so beautiful! 
But there is something attractive in Ten singing in his native language.. I’m in love yet again with him!",36,2023-03-26T10:40:56Z
@bee_sakw,ดีมากค่ะ ถูกใจมากค่ะ 💚🇹🇭,0,2023-03-26T10:39:26Z
@duanga6709,เต๋อคือคนไทยค่ะๆๆๆๆ❤❤,1,2023-03-26T10:37:16Z
@mumin5684,เพราะมากที่ฉุด,0,2023-03-26T10:36:27Z
@Kathrinemexo,งื้ออออ ใจบาง ใจเหลวหมดแล้ววว 😭😭😭💓,0,2023-03-26T10:36:23Z
@stayinpxx,เต๋อคือคนไทยคนนึง🥹 น้องเตนทำใจนี่ melt เว่อ🫠 พิคุณตาหวานมากกก🥰,1,2023-03-26T10:36:10Z
@ห่อหมกอร่อยมาก,ร้องไทยชัดมาก กรี๊ดดดดดด,1,2023-03-26T10:34:40Z
@ptlck2951,เพราะมากกกกก,0,2023-03-26T10:33:32Z
@zhang1243,อยากร้องไห้ ฮือออ ดีมากกก ดีทุกคนนน เธอเชือดฉันได้นิ่มๆด้วยรอยิ้มและเสียงของเธอ🥺🫶🏼✨🤍,1,2023-03-26T10:33:11Z
@merliahkk7290,พี่เตนล์ร้องเพราะเหมือนคนไทยเลยค่ะ😭😂,0,2023-03-26T10:30:14Z
@ppatidisme,หูเคลือบทอง ตาเคลือบเพชร แก้เอ้ยยยไม่ไหวๆๆๆ เพราะมากทำไงดี แล้วร้องกันชัดมากแบบมากกกก เก่งที่สุดทุกคนเลยเลย ดีงามดีเยี่ยมดีเลิศประเสริฐแบบเว่อวังอ่ะ 🥹♥️,0,2023-03-26T10:28:23Z
@bombcherry2822,Pokoknya aku cinta kaliannnnnn,0,2023-03-26T10:28:12Z
@plukii_kii,เสื้อฟ้าคนไทยรึเปล่าคะ,0,2023-03-26T10:23:50Z
@Bowy_bbowbowl,ละมุนมาก❤❤,0,2023-03-26T10:20:22Z
@สุทัศน์-พ8ณ,ภูมิใจมากเววีย์ดีที่สุด,0,2023-03-26T10:18:39Z
@ChalintraPrangthong,I literally love it! You all deserve love from Thai fan.❤,0,2023-03-26T10:17:57Z
@เสี่ยวป๋าย,เด่กเล้กเก่งกันมากๆเลยคั้บ 🥹🥹✨✨✨✨💐💐💖,0,2023-03-26T10:16:50Z
@giimpopooo8497,พี่เตนล์ร้องเพลงไทยชัดมากค่ะ😭😭😭😻,1,2023-03-26T10:16:39Z
@lookke501,모두가 매우 목소리가 높습니다.💗,14,2023-03-26T10:12:27Z
@kru.nokthong,เซียวจวิ้น เกือบจะเป็นคนไทยละ 👏👏👏👏👏👏,1,2023-03-26T10:06:24Z
@wangzhan8510,เอาอีก เพราะมาก เริศมาก หนูชอบ เอาอีกค่ะ เอาอีก😭😭😭💚,1,2023-03-26T10:03:24Z
@mawmeaw2592,ละมุนละไมมากจ้า กรี๊ดดดดด,0,2023-03-26T10:01:20Z
@brthdyboy,SUKAAA BANGETTTTT 💚💚💚💚💚,0,2023-03-26T10:00:07Z
@ilisayou4490,เขยไทยย 🫵🏻,0,2023-03-26T09:57:58Z
@Mmei-sk8sl,หนูรักพี่คุนเหมือนหมา หนูชอบพี่ชิตจนโงหัวไม่ขึ้น หนูชอบพี่เต๋อจนไม่มีแรงยืน ชอบสามคนมากๆเลยนะ เสียงก้ดี หน้าตาก้ดีคูณล้าน ทุกคนมาฟัง,0,2023-03-26T09:56:58Z
@kamonratchada9951,เชียวจวิ้นสำเนียงไทยชัดมากชัดทุกคำเลย❤❤❤,3,2023-03-26T09:55:45Z
@candle2879,กิ้ดหนักม้ากกก,0,2023-03-26T09:55:26Z
@chonjun4192,โดนนนนตก แล้วจร้า  ❤❤❤❤,0,2023-03-26T09:51:34Z
@ac6852,THIS WAS SO CUTE 😭😭😭😭 A THAI COVER???? ICONIC!!!! INTERNATIONAL SUPERSTARS 🤩🤩🤩💚💚💚✨,2,2023-03-26T09:51:31Z
@witchutakhunudta5749,เพราะมาหเสียงน้องเตนล์หวานมากกกกก หวานปานน้ำผึ้งเดือนห้า แงงงงงงงงงงงงงงงงงงง เก่งมากเลยนะไอ้ต้าวน้องเตนล์ พี่ภูมิใจในตัวเตนล์มากเลยนะ,31,2023-03-26T09:46:51Z
@Ham-pe7qm,เริ่ดดด,1,2023-03-26T09:45:39Z
@asr5083,xiaojun ganteng bgt astaga 🤩🤩,0,2023-03-26T09:43:17Z
@sadbutaesthetic1357,เห้ยพี่!! ละมุนมาก,0,2023-03-26T09:38:43Z
@Vaniaannisaptr,Ten fasih bgt bahasa thai nya,5,2023-03-26T09:38:19Z
@okaydue9301,เสียงละมุนฝุดๆ,0,2023-03-26T09:36:37Z
@norkrabiengnaisuanlungban,Thai accent from Xiaojun is really great. No joke.,1,2023-03-26T09:35:41Z
@daisyflower5855,เตนล์ร้องเพลงไทยเพราะมาก😭😭🫶🏻🫶🏻💖💖💖,5,2023-03-26T09:35:37Z
@Hachiiibch,นึกว่าอยู่บนสวรรค์TT ยิ้มตั้งแต่ต้นคลิปยันท้ายคลิป,0,2023-03-26T09:32:18Z
@im_nicha1691,โดนสาบให้ตายแล้วตายอีกจริงๆ🥺❤🫶,0,2023-03-26T09:25:14Z
@lekrapiseth,Ten is most beautiful Thai's Voice I never heard💌✨,14,2023-03-26T09:22:49Z
@rendesvsous,keren keren,0,2023-03-26T09:19:14Z
@tarachayano.304,ดี๊!!,0,2023-03-26T09:18:57Z
@rendesvsous,the song is alr great plus their angelic voices omg ♡______♡,0,2023-03-26T09:18:30Z
@moonstarline,How does xiaojun voice just sound good in every languages,0,2023-03-26T09:18:23Z
@doyoung3301,เก่งที่สุดเลย💚💚💚,0,2023-03-26T09:17:52Z
@rendesvsous,this us sooooo good,0,2023-03-26T09:17:44Z
@moonstarline,I hope they cover more thai songs 🤭,0,2023-03-26T09:16:56Z
@hn.nn0u,"더쥔아... 오랜만에 봐도 역시 넌 여전히 잘생겼구나 그래,, 사랑행,....",1,2023-03-26T09:16:45Z
@rynsdaily,Our precious boys ❤,0,2023-03-26T09:15:50Z
@sikwan4397,น่ารักที่สุดคับบบ,0,2023-03-26T09:15:24Z
@haniifah3122,OMG 💚💚💚,0,2023-03-26T09:14:17Z
@VyNguyen-qw7zd,❤❤❤,0,2023-03-26T09:11:16Z
@wongmaidang,เราว่าเราโดนสาปให้ขิตเพราะเสียงเขาเนี่ยแหละ555,0,2023-03-26T09:10:50Z
@dayangkuainfarhana2423,such an all rounder ❤️❤️❤️,0,2023-03-26T09:10:06Z
@dayangkuainfarhana2423,dekji alu tenn!!! 😭❤️❤️,0,2023-03-26T09:09:51Z
@pummer220,เต๋อจ๋าา,0,2023-03-26T09:09:37Z
@anyax4103,sumpah suaranya bagus banget ya ampun ^^,0,2023-03-26T09:08:03Z
@My_nikkiruby3114,Eu amei isso demais!!!!,1,2023-03-26T09:05:03Z
@kkofg,เตนล์~ ลูก~ นานๆ ร้องเพลงไทยที ไม่ผิดหวังเลยจริงๆ,7,2023-03-26T09:04:35Z
@mylody16,im in love,0,2023-03-26T09:02:56Z
@khxwpun_x0,เป็นเหมือนหยาดน้ำทิพย์ชะโลมหัวจิตหัวใจมาก เสียงของพี่คุนน้องเตนล์พี่เต๋ออ่ะ,0,2023-03-26T08:59:33Z
@pitsineesangphet,ขอให้น้องเตนล์มีโอกาสโคฟเว่อเพลงเดี่ยวๆบ้างนะคะ 🤩🫶🏻,6,2023-03-26T08:57:28Z
@MegaButterflyify,น้องเตนล์คนเก่งของพี่,2,2023-03-26T08:55:51Z
@papakongnongrenjun4876,โอว์โหว์เธอส์  หวานเจียบส์,0,2023-03-26T08:55:43Z
