author,text,likes,published_at
@Imvielll,Sebenernya gua g ngerti mereka nyanyi apa an╥﹏╥ tapi hsjsvakvsjs bagus bngt gila>_<,0,2023-03-25T11:41:04Z
@teawped,😭😭😭💞💞💞💞 เพราะมากค่า เก่งสุดๆๆๆ ฮือ,0,2023-03-25T11:41:02Z
@fahmaaulia9098,"kemaren orang china cover lagu jepang, sekarang orang china cover lagu thailand bener benerrr dahh nihhh yaaa🫶🏼🫶🏼",0,2023-03-25T11:41:02Z
@MINIYURIII,เพราะมากเลยค่ะ พี่คุนกับเซียวจวิ้นร้องชัดมากกก เตนล์ก็เสียงหวานมากกกก,2,2023-03-25T11:40:55Z
@jungkookscomplexmind6505,Their vocals are so angelic and they complement each others vocals,0,2023-03-25T11:40:53Z
@กขคง-ศ5ฌ,เก่งมากกกกก เววี่เก่งกันมากๆๆๆ,0,2023-03-25T11:40:48Z
@kittiyaphasomsup9221,ฟังโต๊ะริมเวอร์ชั่นนี้เขินชิบหายยย💚,0,2023-03-25T11:40:46Z
@cozaii,สุดปังไปเลยค้าบพี่ผมมมม,0,2023-03-25T11:40:46Z
@POPPYYLEEE,น้องเตนล์เสียงเพราะมากกกก ❤❤❤❤,0,2023-03-25T11:40:45Z
@bellepyc7958,โอ๊ยเเม่ละมุนนี ละมุนใจอะ ลูกค้าหล่อมากนะ,0,2023-03-25T11:40:44Z
@doungpornaiemsaard4784,"So cool that Ten, Kun, Xiaojun are the best vocal.",2,2023-03-25T11:40:41Z
@hilmaayu453,"Keren banget Kun, Ten, Xiaojun. I love this cover song",0,2023-03-25T11:40:41Z
@syl5617,Keren banget,0,2023-03-25T11:40:39Z
@2.22ขัตติยาณีท้าวแก้ว,เพราะมากเลยค้าบบmvก็ดีมากดีทุกคนเลยยเก่งกันมากๆๆๆๆๆๆๆชอบมากๆๆๆๆๆเลยค้าบบ💓💓💓💓,1,2023-03-25T11:40:39Z
@Binzou19,Xiaojun looks like fourth 🥺💜,0,2023-03-25T11:40:35Z
@mamaru7122,หือออออ ดีมากกกก ละมุนมาก,0,2023-03-25T11:40:34Z
@chinjung9513,เกินที่สุดไปแล้วอะ แบบมากๆๆๆ ดีดีดีๆๆ,0,2023-03-25T11:40:31Z
@patraspaces,TEBAK APA YANG KURANG DARI WAYV????🥺,0,2023-03-25T11:40:26Z
@jauzamitsal2532,BERBUKALAH DENGAN YANG MANIS SEMANIS SENYUM DEJUN,0,2023-03-25T11:40:25Z
@jirapayuk1632,Ten is sound so sweet ❤❤,1,2023-03-25T11:40:23Z
@bidarasalma5875,"Keep shining Kun, Ten, Xiaojun 🫶🫶🫶",0,2023-03-25T11:40:22Z
@hanidahaans9401,😍😍😍😍😍😍,0,2023-03-25T11:40:21Z
@yulyarachma173,"Kalian keren banget😭
Arasement Kun ge gak pernah gagal
you all did well guys 👏❤❤",0,2023-03-25T11:40:20Z
@tsrp.9798,I love the highnote TEN❤🎉,4,2023-03-25T11:40:19Z
@tata_1st,เสียงเพราะเสียงหวานนุ่ม 3 คน 3 สไตล์ไปเลย นอกจากเสียงที่สะกดใจหวานเจี๊ยบรอยยิ้มของเธอก็หวานจ๋อยไปเรยดิ,1,2023-03-25T11:40:18Z
@Muumuu-qt5jt,เขินชะมัดเลยเว้ย,1,2023-03-25T11:40:18Z
@navylee42,TEN~❤❤❤❤❤,0,2023-03-25T11:40:16Z
@sai.i.i,เริ่ด เทอมันเริ่ดคุนเกอ พี่น้องเตนล์ เซียวจวิ้น เริ่ด👏🏼🥹✨,0,2023-03-25T11:40:13Z
@natsuya4752,ดีมาก เริศมาก เยี่ยมมากค้าบบบบ☺️😚,0,2023-03-25T11:40:07Z
@lynqblu,เป็นโต๊ะริมที่พิเศษสุดๆ😘,0,2023-03-25T11:40:07Z
@tata-nl8uh,hiks suara mereka terlalu merdu d telinga gue😭,0,2023-03-25T11:40:04Z
@goodtobecha,ดีมากกกก🥹🫰🏻💓💓💓💓,0,2023-03-25T11:40:02Z
@meenmii210,เพราะมาก ปริ่มสุดไฟๆๆๆๆๆๆ,0,2023-03-25T11:40:01Z
@navylee42,เตนล์นั่งโต๊ะริมใช่ไหมคะ น่ารักซะสาแก่ใจเลย,1,2023-03-25T11:40:01Z
@paxpzploy3366,เคลิ้มมากกกกกกกกกกกก เก่งมากเนยอะ ❤❤️❤️❤️❤️,0,2023-03-25T11:40:00Z
@Katiiiiiiiiiiiiiii,น้องเตนล์เสียงหวานมากกกกที่สุด อยากฟังน้องร้องอีกเยอะๆ หูเคือบทอง ดีที่สุด เยี่ยมที่สุด ตัวแด๊ด ตัวมัม ตัวมารดา ตัวสูตินาร😍😍,1088,2023-03-25T11:40:00Z
@satitapanpia785,อ้ยยยยยร้องชัดเว่อ,0,2023-03-25T11:39:53Z
@พวกเอ๋อเอ้ย-งมงาย55,ขอบคุณที่มาเป็นเรื่องหล่อๆในชีวิตค่ะ,1,2023-03-25T11:39:48Z
@patraspaces,FASEH BANGET PENGUCAPANNYA 🥺,0,2023-03-25T11:39:46Z
@fernnykimchannel3440,น่ารักมากกกกก❤,1,2023-03-25T11:39:46Z
@plengyoungseoa,เริ่ดมาก เว่อร์มาก ละมุนสุดๆ เก่งอ่าาาาาาส,1,2023-03-25T11:39:42Z
@nurfadilahdwig579,I was very impressed to hear Xiaojun and Kun's excellent recitation. I was also very impressed with the members of WayV who are very multilingual. Great,2,2023-03-25T11:39:41Z
@maziyeee5150,WAYV VOCAL LINE ALWAYS MAKE ME FEEL PROUD. LOVE YOU KUN TEN XIAOJUN ❤❤❤,2,2023-03-25T11:39:40Z
@miniakira5345,เสียงเหมียวเตนล์ทำใจละลาย เฉลยยังว่าเซียวจวิ้นเป็นคนไทยร้องชัดมาก พี่คุณคือดีย์บ่ไหวเด้อ,0,2023-03-25T11:39:38Z
@winwinshoodie,The highnote.... Junjun 😭😭😭😭,1,2023-03-25T11:39:35Z
@lovxqz-u5x,ฮื่ออออ ได้ฟังเเบบเต็มเเล้วดีมาก💚💚,1,2023-03-25T11:39:34Z
@namuhnonunless4007,เตนล์ร้องไทยชัดมากค่ะ,1,2023-03-25T11:39:31Z
@issareethuntaweerojanachai4524,ดีมากๆเลยคับ mvสีสวยมาก เตนล์เสียงหวานมากๆเลย เก่งมากๆคับ,15,2023-03-25T11:39:28Z
@onebigdiamond7366,Berbukalah dengan yang manis.....❤,1,2023-03-25T11:39:25Z
@thingstheydonotteachyouats7762,Ten is the man who can out dance you while doing a high note. That’s how insane he is .,83,2023-03-25T11:39:24Z
@parknadhyun3907,Nct wayv serba bisa... Smua bisa dicover dalam bahasa apapun,1,2023-03-25T11:39:23Z
@attaphinyamoonchan9961,เราก้โดนเววี่สาป ให้รักค่ะ😍😍😍💘💘💘💘💅🏻💅🏻💅🏻,1,2023-03-25T11:39:16Z
@tiarasep1585,GREAATTTTTTT,1,2023-03-25T11:39:14Z
@lovsj13elf66,ดีมาก ละมุนสุด ๆ ชอบมากกกก โวคอลก็เว่อวัง ดีงามเสียงน้องเตนล์หวานปานน้ำผึ้งเดือนห้าเลยลูกกก 💚💚💚,39,2023-03-25T11:39:13Z
@pcb.zoeyyy,น้องเตนล์เกินไปมากกกก เทอเชือดชั้นได้นิ่มๆด้วยรอยยิ้มเทอจริงๆ แล้วเซียวจวิ้นร้องชัดเว่อ พี่คุนก็เสียงใสสุดๆ,1,2023-03-25T11:39:00Z
@mkhaofang8510,❤❤,0,2023-03-25T11:38:59Z
@Kd_jaesbacon,so so so so gooooooooooooooood. I hope sm push wayv further than this since they are really precious!,1,2023-03-25T11:38:54Z
@orangecat9328,ดีมากกกกกกจะร้องไห้ในที่สุดก็ได้ฟังแบบเต็มฮื่อออออดีมากกดีมากๆๆๆๆน้องเตนล์เหมือนมีออร่า✨ออกจากตัวตลอดเวลาเสียงเป็นเสียงที่นางฟ้าโรยผงวิเศษให้กินกับข้าวทุกวันคือนุ่มหวานอร่อยกลมกร่อมพี่คุนคือเสียงเทวดาสุดๆเต๋อคือเสียงของเทวดาตัวน้อยๆฮื่อออออดีมากกกกร้องไห้ดีกว่า🥹💐✨,1,2023-03-25T11:38:53Z
@c.marisaa46,เซียวจวิ่นหนูคือคนไทยค่ะลูก 😂😂💚💚,0,2023-03-25T11:38:51Z
@nuk_kantida,❤❤,0,2023-03-25T11:38:51Z
@bampakaporn5592,เตนล์หวานมากเหมือนพี่ฝันอยู่,0,2023-03-25T11:38:50Z
@fdnemojipz9725,หวานย้อยยยยยยยยย,0,2023-03-25T11:38:46Z
@pmpk9936,"'ถ้าไม่เก่งให้ซ้อม ซ้อมไปเลย ยังไงมันต้องดีขึ้น' 
'เตนล์เชื่อว่าการกระทำมีผลมากกว่าพรสวรรค์' 

นี่ไงผลของความพยายาม ไม่รู้ว่าผ่านการฝึกมามากแค่ไหนแต่เตนล์ร้องเพลงเก่งขึ้นมากกกกกกกกก เก่งมากเลยรู้ไหม",1,2023-03-25T11:38:45Z
@becharr_,เพราะมาก หนุจะตาย,0,2023-03-25T11:38:44Z
@Bunnypiu,อ้ยเพราะมากกก👍🏻👍🏻✨🫰🏻,0,2023-03-25T11:38:42Z
@bosbelesbekrds,<3,0,2023-03-25T11:38:38Z
@yothiga,"Omg, Their voice! Their visual! Everything🎉❤❤❤❤",2,2023-03-25T11:38:36Z
@tongdongtd,เก่งที่สุดเลย❤,0,2023-03-25T11:38:35Z
@zzongcat,Shet lk gsahlljhsagjk MULTILINGUAL GODSS,0,2023-03-25T11:38:31Z
@needyverse,WAYV UNITES THE PLANET FOR REAL 🌏🍃🕊🥰,1,2023-03-25T11:38:30Z
@yourbabyS06,ชอบมากๆดีมากๆเลยยย😭💘 เต๋อร้องชัดมากกก พี่คุนก็ดีเว่อออ แต่ชอบเสียงเตนล์มากก ยิ่งร้องภาษาไทยคือละมุนนน อยากฟังอีกเยอะๆเลย😭💘,0,2023-03-25T11:38:26Z
@blueellmonilo,UWAAHHHH AKHIRNYAAAAA...,0,2023-03-25T11:38:25Z
@Plengaride.9,มันแบบ เธอมาทำให้ละลาย โดนสาปให้ตายแล้วตายอีก  ร้องออกมาได้ดีมาทุกคนเลย งานสายตาเอย เสียงเอย ไฮโน๊ตคือสุดยอด​,0,2023-03-25T11:38:21Z
@pacarleejeno,Good voice 😍💚💚💚,0,2023-03-25T11:38:21Z
@fearnly4734,Xiaojun ร้องไทยชัดมากก ❤❤ น้องเตนล์ พี่คุณ น่ารักกมากกก😍😍,1,2023-03-25T11:38:20Z
@gogo-sf6ee,ยอด ดีเลิศ เด็ดขาด อันดับหนึ่ง ศักดิ์สิทธิ์ มหัศจรรย์ ที่สุด สุดยอด เยี่ยม ยอดเยี่ยม ยอด เยี่ยมยอด ดีที่สุด เลิศที่สุด ชนะเลิศ เลิศเลอ ดีเด่น สุดเหวี่ยง วิเศษ ฮีโร่ บริสุทธิ์ ล้ำเลิศ ชั้นเลิศ เลิศล้ำ เด็ด หนึ่งเดียว พิเศษ ยอดไปเลย เยี่ยมไปเลย ที่หนึ่งเลย โดดเด่น ปาฏิหาริย์,0,2023-03-25T11:38:19Z
@krtytiniidhs,GK ada yg di mengerti liriknya tpi enak banget suaranya 😭😭😍😍😍😍,0,2023-03-25T11:38:17Z
@pukk-ql8gd,น้องเตนล์เสียงหวานมากก เสียงเทอทำให้ละลาย โดนสาปในตายแล้วตายอีก 🥰🥰,0,2023-03-25T11:38:17Z
@TheOn13on,Slayyyy,0,2023-03-25T11:38:16Z
@aurorakarisma5037,"keren dan selalu kerenn, proud of you guys",0,2023-03-25T11:38:16Z
@mytreasure3638,ชอบเพลงนี้อยู่แล้ว ก็ชอบขึ้นไปอีก น่ารักกันมากๆเลย ร้องเพราะมากแล้วก็ร้องชัดมาก👏  เก่งกันมากๆเลย💚💚💚,16,2023-03-25T11:38:16Z
@michellelee3299,เธอมาทำให้ละลาย เออ ละลายจริงๆค่ะ ใจละลาย 😊😊,0,2023-03-25T11:38:11Z
@sosweetcaramelsalt2297,Perfect Ten,1,2023-03-25T11:38:06Z
@pittsineechindawong8286,บ้าจริง ! นี่เราหยุดยิ้มไม่ได้ ! เขินพี่ชิตหนักมากก กรี้ดดด 🥺🥺 พี่คุน เต๋อเก่งอ่าา,1,2023-03-25T11:38:04Z
@Mononona-T00,กรี้ดดดดน้องเตนล์ของเเม่,2,2023-03-25T11:38:00Z
@alis1341,Sm เฉลยเถอะว่าพี่เต๋อเป็นคนไทย!!,0,2023-03-25T11:37:53Z
@Mariaxx14fx44r,"Можно альбом для WayV на тайском, пожалуйста!!!🙏🙏🙏🙏🙏🎉",0,2023-03-25T11:37:50Z
@arayabutsiri9720,คุนกับจวิ้นร้องชัดมากกเตนล์ก็ร้องเพราะมากก ตอนที่ฟังในร้องข้ามก็ว่าจะตุยแล้วนะ เจอแบบนี้ไปไม่เป็นเลย,0,2023-03-25T11:37:50Z
@_angel8219,หล่อมากค่ะ แกรรรคนจีนจริงป่ะเนี่ยยยย สำเนียงคือคนไทย100000% แกรรรโคตะระเพราะเลยแม่😍😍,2,2023-03-25T11:37:47Z
@nammnaaa4683,เพราะมาก ดีมาก พี่คุนกับเซียวจวิ้นร้องชัดกันมากด้วย 👍👍👍,1,2023-03-25T11:37:46Z
@irislee3080,น้องเตนล์ร้องเพราะมาก เก่งจังคับ ทุกคนเก่งมาก,2,2023-03-25T11:37:45Z
@p1hlover,เพราะมาก ๆ ค่ะ เตนล์เก่งมาก!,2,2023-03-25T11:37:45Z
@needyverse,🧘😌🕊☺️☁️🥲,1,2023-03-25T11:37:44Z
@sunshinet2460,เก่งมากกก คุนเกอ น้องเตนล์ เต๋อออกเสียงเก่งมากเลยลูก,1,2023-03-25T11:37:44Z
@giftloveification,Ten voice so good for Thai song 👍🏻,10,2023-03-25T11:37:43Z
@dookfa_dada,เพราะมากๆๆๆๆ,0,2023-03-25T11:37:41Z
@mwchani,ร้องชัดมากกกก,0,2023-03-25T11:37:39Z
@Napatsawan-lg1eg,อวยยศ เพราะมากหูเคลือบทอง,1,2023-03-25T11:37:38Z
@waranyaalmkrajang631,เพราะมาก หบ่อมาก สุดยอด ยอดเยี่ยม,1,2023-03-25T11:37:37Z
@luvly04,ร้องเพราะกันทุกคนเลย เก่งมั้กๆ ❤,1,2023-03-25T11:37:34Z
@butsaba13,ละมุนหูมากค่ะ🥹,1,2023-03-25T11:37:33Z
@marroncream____,i love ten’s beautiful chorus♡,22,2023-03-25T11:37:33Z
@Leet4nny,พี่เตนล์หล่อมาก ทุกคนหล่อมากก🤍🤍,2,2023-03-25T11:37:31Z
@chittaphonyka,เตนล์เพราะมากกก อินเน้อกระจายจิกได้จิกก ฮือออ ร้องเพลงไทยอีกเยอะๆนะลู๊กกก,5,2023-03-25T11:37:29Z
@aisyahhayantiii8434,대바아아악..... SO PROUD OF U GUYS❤❤💚💚,2,2023-03-25T11:37:25Z
@aurorakarisma5037,sukakkkkkkkkkk,0,2023-03-25T11:37:24Z
@pompommy11,♥♥♥♥♥♥,0,2023-03-25T11:37:20Z
@mysnchy,ทุกคนเก่งมากก ขอบคุณสำหรับเพลงดี ๆ นะคะ💚💖🫶🏻🫶🏻🫶🏻🫶🏻,0,2023-03-25T11:37:18Z
@bbynongtoey,เราตายแล้วพวกนาย,0,2023-03-25T11:37:18Z
@rungwadeeuthaiwat4699,เพราะมากกกกก หูเคลือบเพชรแล้วววว,0,2023-03-25T11:37:17Z
@sunnyshine5562,Tagalog song next please💚💚💚,0,2023-03-25T11:37:17Z
@wanna7848,เพราะมาก เสียงแต่ละคนคือละมุนไม่ไหววว,0,2023-03-25T11:37:14Z
@kertnovenyi4205,เพราะมากค่ะ!!!,0,2023-03-25T11:37:14Z
@realissimon,ละลายยย,0,2023-03-25T11:37:10Z
@snooywoo3980,Love it soooooo muchhhhhh😭💗,0,2023-03-25T11:37:10Z
@heidi17official,What a harmony!!,0,2023-03-25T11:37:08Z
@tia2196,Another masterpiece <3,0,2023-03-25T11:37:08Z
@pppop_prn,น้องเตนล์ทำให้ฉันละลายยย โดนสาปให้ตายแล้วตายอีกกก,1,2023-03-25T11:37:06Z
@janelee7802,เพราะมากๆๆๆ เพราะสุดๆๆ,0,2023-03-25T11:37:05Z
@sakurafujiwara4484,เพราะมาก ดีมากกก ขอบคุณ SM ที่อนุญาตให้เด็ก ๆ โชว์ฝีมือคัฟเวอร์เพลงไทย,0,2023-03-25T11:37:04Z
@sokim9268,พิ้เต๋อคือไทยจ๋าเลย กรรมการอึ่ง,0,2023-03-25T11:37:04Z
@brite4005,"เป็นเพลงแอบรักที่ทำให้เรายิ้มได้
Such a one sided love song that make me smile.",0,2023-03-25T11:37:03Z
@sympy-cb2we,"แง๊ เขินสายตาพินุ้งเตนล์ ละลายแล้วววว this cover is very soothing to the ears. Thank you KUN for such a perfect rearranged , thank you TEN, KUN & XIAOJUN for the perfect harmony. Hope to hear more covers from the WAYV members🎉🎉🎉🎉",4,2023-03-25T11:37:01Z
@Nakwan_l,เพราะมากกกกกกก❤,0,2023-03-25T11:37:00Z
@มิ้ม-ง3ฟ,เพราะมาก,0,2023-03-25T11:36:57Z
@muthiaatikahriza2204,KUN AND XIAOJUN YOUR VOICE ARE SO AMAZING,1,2023-03-25T11:36:55Z
@jutaratongat3001,Wow🎉🎉🎉🎉love them❤,0,2023-03-25T11:36:46Z
@aby5878,น้องเตนล์ 💖 เก่งกันทุกคนเลย,1,2023-03-25T11:36:45Z
@Cwiisan,"Jujur selain ngefangirl cowok korea aku jga fangirlan cowok thai gara gara msp suka lagu thai didenger "" lagu thai tu canduuu bangetttt ini teruss dikasih coveran versi bujankk😭😭",0,2023-03-25T11:36:43Z
@fay0078,"วงอะไรทำไมมันหล่อขนาดนี้วะ ถ้ามาครบมีหวังดั่งเพลง ""เธอมาทำให้ละลายโดนสาปให้ตายแล้วตายอีก"" คนกลางน่ารักเว่อร์ๆๆๆๆๆๆๆๆ",0,2023-03-25T11:36:38Z
@Mine-ze1lm,OMG!😭😭👏🏻👏🏻👏🏻👏🏻💕💕💕💕,0,2023-03-25T11:36:37Z
@chippychu7770,OmGGGGGGG  so good😭😭😭😭😭,0,2023-03-25T11:36:37Z
@TheOn13on,ดีเริ่ด ยอดเยี่ยม,0,2023-03-25T11:36:35Z
@Khunrabbit,ใช่ เธอน่ารักอ่าเตน เสียงเพราะมากเลยครับ,0,2023-03-25T11:36:34Z
@xinmanren,Xiaojun has a gorgeous voice😍😍,1,2023-03-25T11:36:31Z
@TheOn13on,แงงงง ปังมาก❤❤,0,2023-03-25T11:36:23Z
@lakanap.6933,โอ้พระเจ้าช่วย! ฉันเขินพี่เตนล์มากเลยค่ะะะ luv u P'TEN! TT💓💓💓,2,2023-03-25T11:36:22Z
@julyramyeon,เต๋อร้องชัดมาก😭😭😭,0,2023-03-25T11:36:22Z
@celunezyarre,😭❤️❤️❤️❤️❤️,0,2023-03-25T11:36:16Z
@ChanpenChanpen-z7j,จริงๆแล้วเซียวจวิ้นคือคนไทย😅,0,2023-03-25T11:36:15Z
@muthiaatikahriza2204,I like it so much!!! Xiaojun your voice is the best,0,2023-03-25T11:36:15Z
@lovesehunn0412,啊啊啊啊啊啊啊好好听❤,1,2023-03-25T11:36:05Z
@peacefulesthertan,Tennie’s sweet vocals❤I am ascending to heaven❤,86,2023-03-25T11:36:04Z
@taetenism3543,"cover apa ini niat bangett! as always honey voices from wayv vocals❤ 
su su naaa",0,2023-03-25T11:36:03Z
@prawpp9047,ขอเพลงไทยให้น้องเตนล์ร้องอึกได้มั้ย มันดีไปหมดเลย ขออีกๆๆ,1,2023-03-25T11:36:02Z
@umisangadahikfi1507,"Ten's voice is fres like fruits, kun's voice is soft like cotton, dejun's voice is sweet like candy... 3 amazing voices became one... So great collaboration... Love,love,love you all guys💚💚💚",148,2023-03-25T11:36:01Z
@joylucasw5604,thank you guyssss ❤,0,2023-03-25T11:36:01Z
@sosweetcaramelsalt2297,How long did it take to wait to hear Ten sing Thai songs?  This is still not enough for me.  Can you have one more Thai song Ten please ~. It's really good.,0,2023-03-25T11:35:58Z
@tongsirirert6696,เซียวจวิ้นหนูเป็นคนไทยใช่มั๊ย สารภาพมานะลู๊กกกก,0,2023-03-25T11:35:56Z
@natchamatlimakunawoot6821,Ten out of ten for Y'all👏👏,2,2023-03-25T11:35:52Z
@yyim-n2r,🫶🏻🫶🏻👏🏻💚💗,1,2023-03-25T11:35:51Z
@bantitaleenud,น้องเตนล์น่ารักมากกกก เซียวจวิ้นพี่คุนร้องชัดมากกกกกก😭😭😭,2,2023-03-25T11:35:48Z
@fikasabila2169,Their voice is so  ❤❤❤ the song matches their voice so well tho,2,2023-03-25T11:35:44Z
@karattee,kun's honey voice fits this song so much,3,2023-03-25T11:35:44Z
@punyanuchinsuwan5374,ไม่ใช่แค่ฝัน ที่ฉันต้องตื่น ฮื่อ เพราะสุดๆเลยคับๆๆๆๆๆ 😭🫶🏻,1,2023-03-25T11:35:43Z
@อมิตามับสันเทียะ,เซียวจวิ้นเสียงดีมากกกก,1,2023-03-25T11:35:41Z
@ulzbae,เพราะมากเลยยยย🥹💖🫶🏻✨🌷,1,2023-03-25T11:35:40Z
@joylucasw5604,WUUUUUUHUUU,1,2023-03-25T11:35:38Z
@nanaaa8465,BAGUS BANGETT WOEYY!!😭❤️,0,2023-03-25T11:35:36Z
@pineappleeiei7980,เตนล์เสียงหวานมากกกก 🥰🥰🥰,2,2023-03-25T11:35:34Z
@KennethS-d9t,เสียงโครตจะไทยเลย เพราะมาก,1,2023-03-25T11:35:33Z
@febjaymyten,เสียงน้องเตนล์หวานมากกกกก หวานแบบตัดขาพี่ได้เลยลูก พี่คุนกับเต๋อก็ร้องเก่งมาก เสียงเทพอยู่แล้ว เพลงเพราะจริงๆค่ะ เวอร์ชั่นนี้หวานทั้งเพลงเลย ไวบ์มันแบบนั้นอ่ะ ❤❤❤❤,42,2023-03-25T11:35:31Z
@pkgz5517,TEN’s voice is so beautiful❤ Can’t believe it!! He’s improving so much😊 Well done Kun Ten Xiao ❤,33,2023-03-25T11:35:30Z
@littleReflex,ยอดเยี่ยม เกรียงไกร ยิ่งใหญ่ เววี่!!!,0,2023-03-25T11:35:28Z
@K_pm,สุดยอด!!!!,1,2023-03-25T11:35:27Z
@Yedeeyedamiee,"เฮียคุนหล่อ พระเจ้ามากค่ะ เสียงดี หวานกรุบ 
เตนล์คือเสียงหวานมาก เพราะค่ะ ชอบบบบ
เซียวจวิ้นคือที่สุด ร้องชัดมาก ฟังแล้วหูเคลือบทองสุดๆ",14,2023-03-25T11:35:26Z
@petchionaryy1020,ดีมาก ปังมาก เริ่ดมาก เพราะมาก หูเคลือบทอง เววี่สุดยอด !!! ลงตัว นัว กลมกล่อมเว่อร์ !,1,2023-03-25T11:35:25Z
@muhibahawaliyah3554,"our vocal kings, blessed my ears",2,2023-03-25T11:35:24Z
@wiphawansrisoi1482,ละลายแล้ววววววว คุนเกอทำเพลงดีมาก พี่เต๋อ น้องเตนล์ ร้องเพราะมากๆ ฮรือออออออ รักกกกกกกก 💕,1,2023-03-25T11:35:23Z
@jaryjeonglap4968,พี่เตนล์ค้าบบบ ดาเมจแรงมาก!!!!! เซียวจวิ้น เฉียนคุนหล่อมากกก ทุกคนร้องเพลงไทยได้สุดยอดจริงๆ 😍🇹🇭,4,2023-03-25T11:35:23Z
