author,text,likes,published_at
@waewh.m.107,เพราะมากค่ะ ชอบมาก,0,2023-03-25T14:00:41Z
@rocket6394,เพราะมากกกกกกกก,0,2023-03-25T14:00:37Z
@klyjzklyzz7133,Suka banget dehhh,0,2023-03-25T14:00:35Z
@njunll3753,"I always like WayV's songs, it's always good, friends, let's support WayV❤",7,2023-03-25T14:00:18Z
@Do0tenlee,ตายจริง ฉันอะอยู่ไม่ไหววว,0,2023-03-25T14:00:16Z
@Mymoono,ฟังแล้วเหมือนลอยหูเคลือบทอง ดีเลิศ ยอดเยี่ยม ที่สุด ประเสริฐ ไม่มีใครเทียบ 🎉🥳🫶🏻✨,0,2023-03-25T14:00:09Z
@youhave_bbnarii,D makkkkkkkk,0,2023-03-25T14:00:06Z
@Sleeptroscope,เธอมาทำให้ละลาย โดนสาปให้ตายแล้วตายอีก 💖 เป็นโต๊ะริมที่ดีมาก รู้สึกหูเคลือบทองฝังเพชรไม่ไหว อยากเป็นสาวโต๊ะริมที่โดนสามหนุ่มร้องเพลงให้เลย 🙈,1,2023-03-25T13:59:51Z
@namtarnmd7438,ดีย์ๆๆๆ แบบว่าชอบมากแงงงง,0,2023-03-25T13:59:45Z
@fuwafuwachin3696,อนาคตทั้งวงจะพูดภาษาไทยได้,0,2023-03-25T13:59:37Z
@trineEm,This cover was so cute and relaxing,0,2023-03-25T13:59:31Z
@koohkep,ร้องเพราะมากค่ะ 🥰,0,2023-03-25T13:59:30Z
@ilhamalviando1892,"OMG! Love this so much, thanks for singing this beautiful song. Love from Indonesia!",1,2023-03-25T13:59:30Z
@definitelynot66,Wayv NEVER disappoints us,1,2023-03-25T13:59:27Z
@sky92bnbb,คุนกับเซียวจวิ้นร้องชัดมากกกกก เตนก็ร้องได้ละมุนสุดๆ!!,1,2023-03-25T13:59:26Z
@Babymeow_w,เพราะมาก ❤️‍🔥😭❤️‍🔥 ดีสุดๆๆๆๆ,0,2023-03-25T13:59:20Z
@official_a.u.m,พี่เต๋อเก่งมาก พี่เตนล์เก่งมาก คุนเกอเก่งมากก รักรักรัก,0,2023-03-25T13:59:18Z
@tatakookky3168,🫶🏻🫶🏻🫶🏻,0,2023-03-25T13:59:17Z
@fuwafuwachin3696,เพลงโปรด พอได้มาฟังศิลปินวงโปรดของเราโคฟเวอร์มันยิ่งดีไปอีก เสียงทุ่มละมุนโทนมากกกกก เต๋อกับคุนเกอร้องเพราะมากกกกกกก เตนล์คือดีไม่ไหว เพลงนี้เป็นพี่ชิตชี้นตกหลุมรักเมนแม่หยางหยางที่ตกหลุมรักพี่เตน หล่อมากกกก ควรค่าแก่การออกบั้มเพลงไทยมินิกะได้ซักหนึ่งเซ็ท จะซื้อมาเปิดวนฟังเช้นเย็นเลย!!!!,0,2023-03-25T13:59:13Z
@trineEm,Ten singing in Thai Language ahh my heart 🤍,1,2023-03-25T13:59:12Z
@Chuchuzz11,ดีงาม😮,0,2023-03-25T13:59:04Z
@ts.4378,Thanks for cover thai song i'm so happyyyyyyyyy ❤,0,2023-03-25T13:59:03Z
@pancakeajareeya3593,เสียงหวานเพราะมาก หวานกว่าน้ำผึ้งเดือน5 way vดีที่สุดดด mv ก็ดีมากกก ละมุนมากกก😩🫵🫵,0,2023-03-25T13:58:58Z
@aunaun13,ท่อนแรกมาก็โดนเตนล์ฆ่าด้วยสายตาแล้วค่ะ,2,2023-03-25T13:58:52Z
@official_a.u.m,เก่งมาก เก่งที่สุด รักนะ,0,2023-03-25T13:58:51Z
@yenikurnia8277,Keren banget ayang²ku.. baru denger lagu Thai yang ga kayak lagu Thai. Asik didenger. Suaranya merdu banget bertiga.. nambah ke playlist lullaby nih❤❤❤,10,2023-03-25T13:58:47Z
@c4llmeporkor,ดีมากกกกก ดีไปหมดเลย เก่งกันสุดๆ,0,2023-03-25T13:58:44Z
@pythhwn8393,"ทุกคนเก่งมากกกก น้องเตนล์เสียงหวานสุดๆไปเลยอยากฟังเตนล์ร้องเพลงไทยอีกเยอะๆ
เอาอีกค่ะะ!!!! 😭❤❤",5,2023-03-25T13:58:44Z
@thaonguyenvuphuong5658,The language kings 😂,0,2023-03-25T13:58:27Z
@aunaun13,❤❤❤❤❤❤❤ ร้องเพราะมากกกก ปริ่มมมมม ขอบคุณมากๆๆๆที่ตั้งใจกันขนาดนี้ รักมากๆๆๆๆ ทุกคนเล้ยยยย,29,2023-03-25T13:58:18Z
@saranyachaohankham2190,ถ้านี่ไม่ใช่สิ่งที่ดีที่สุด😭😭😭,0,2023-03-25T13:58:08Z
@tspimelgie4551,ให้ตายเถอะแฮรี่!!! เพราะเกินไปมั้ยยละมุนทั้งเสียงทั้งmvเลย เก่งมากกกกก,0,2023-03-25T13:58:01Z
@B2U12,งื่อออ​ WayV น่ารักมากๆเลย​ ขอบคุณมากๆนะที่ร้องเพลงไทยให้ฟัง... แฟนๆชาวไทยคงเอามือทาบอกกันถ้วนหน้า​😊💓 เพราะมากๆ​ ละมุนสุดๆ​ บรรยากาศ​ไทยๆอีก​ ใส่ใจมาก​ สำหรับคุนกับเซียวจวิ้นคงไม่ง่ายเลยที่จะร้องเพลงไทย​ ภาษาไทยคือออกเสียงยากจริงไรจริง​ แต่ทั้งนี้ทั้ง​ 3 คนก็ทำออกมาได้ดีมากๆ​ ประทับใจมาก​ ขอบคุณ​นะ​ หวังว่าในอนาคตจะได้เห็น​ NCT​ ร้องเพลงไทยอีก​ 💚,6,2023-03-25T13:57:45Z
@tinkerbew7237,กรี๊ดดดดดดดดดทั้งสามคนคือปังไม่ไหว,0,2023-03-25T13:57:38Z
@nadyazn2373,FINALLYY,0,2023-03-25T13:57:36Z
@mysweetietenlee3886,น้องเตนล์ร้องเพราะมากค้าบบบ อยากฟังเต็มๆเลยลูกกกก ขออีกเพลงค่ะ,93,2023-03-25T13:57:34Z
@panaleejekjantuek5853,เพราะมากๆ❤❤❤❤ ทุกคนเก่งที่สุดดเ❤❤❤❤❤❤❤❤,0,2023-03-25T13:57:29Z
@innx,เตนล์ดีมากเลยครับ ชอบเตนล์ร้องเพลงไทยมาก จริงๆชอบให้เตนล์ร้องเพลง ❤️‍🔥❤️‍🔥 TENLEE 💜TENLEE 💜TENLEE 💜,3,2023-03-25T13:57:23Z
@sabrinadewantielf,That songs make my heart so deeply melt too cause their suitable vocalist,3,2023-03-25T13:57:07Z
@phooyu7007,หวานเจี๊ยบ,0,2023-03-25T13:56:51Z
@namaoony,ดีมากกกกกกกก หูทองคำสุดๆๆๆๆ😍😍😍🌟🌟🌟😭😭😭🤍🤍🤍🤍💚💚💚💚,0,2023-03-25T13:56:45Z
@mint_2498,เพราะมากๆเลย😸💚💚💚,0,2023-03-25T13:56:43Z
@nanachan1224,"Really hope that they cover "" just being friendly """,0,2023-03-25T13:56:34Z
@lluaah,"ISSO AQUI TÁ TÃO BOOM😭🤧🤧


MENINOS VOCÊS FORAM MARAVILHOSOS ❤ 

AMO VOCÊS ❤️🤩",36,2023-03-25T13:56:32Z
@eerawmipCH,เต๋อกับพี่คุนก็คือคนไทยแบบ 300% 55555555 เพราะมากกก พี่เตนล์ละมุนเวอร์🤍🫶🏻,1,2023-03-25T13:56:31Z
@kxrqmr_5105,ยอมรับมาเหอะว่าเเกเป็นคนไืทยทั้งวง,0,2023-03-25T13:56:29Z
@kimbw1819,สวดยอดเลยค่าาาา💚💚💚TEN💚XIAOJUN💚KUN💚WAYv,0,2023-03-25T13:56:27Z
@18.02-z7i,เขินอ่าาาาาา มันดีมากจริงๆ❤,0,2023-03-25T13:56:26Z
@sabrinadewantielf,My bestie ku and xiaojun da ge cover melt songs,0,2023-03-25T13:56:20Z
@อารยาเพชรจํารัส-ค1จ,เก่งมากอะ​ เววี่เสียงหวานเหมาะกับโต๊ะริม​ mvโทนอย่างสวยเลยพี่ๆ​ บวกหน้าหวานๆเสียงเพราะๆ​ทั้ง3คน เริสสส❤,1,2023-03-25T13:55:49Z
@jongraknawanitchaikul6878,แกกกน่ารักมากกกกกกฮือออ💚💚💚💚💚💚💚,0,2023-03-25T13:55:49Z
@gleeyy0702,Kun and xiaojun sounded like a native thai omg...... This song is so good. Im addicted to it,6,2023-03-25T13:55:42Z
@nonnarinj6522,ดีเริ่ดเว่อร์อลังการเก่งกันมากมากเพราะที่สุดฟังไม่เบื่อ,0,2023-03-25T13:55:41Z
@sso6332,태국어도 배워야되나...🤍,1,2023-03-25T13:55:33Z
@yubiiechan4663,💚💚💚,0,2023-03-25T13:55:29Z
@jenojam6159,เซียวจวิ้นคือเป๊ะมากกกก,0,2023-03-25T13:55:19Z
@nonnarinj6522,เก่งมากกก,0,2023-03-25T13:55:18Z
@aimimi1310,เสียงละมุนมากกกก  สำเนียงคือชัดสุดๆ ดีใจที่ได้ฟังน้องร้องเพลงไทย ทุกคนเก่งมากงับ🥺,47,2023-03-25T13:55:12Z
@bluecream8832,เขินอ่าาาาาาาาาาา,0,2023-03-25T13:55:03Z
@pomutcki,It's refreshing to have them cover non english / korean song,1,2023-03-25T13:54:47Z
@ชนาพรสิงห์ทอง-ร6ฦ,โอ้ยยยน้องเตนล์น่ารักเกินปุยมุ้ยอ่ะ,2,2023-03-25T13:54:27Z
@pomutcki,"WOOOOOW their voice, i will never be tired of it",1,2023-03-25T13:54:20Z
@Eyeorange,ชอบมากกกก ดีมากกกกก อยากพี่เตนล์ร้องเพลงไทยบ่อยๆ❤❤❤,1,2023-03-25T13:54:05Z
@chanisarakwandee4419,ละมุนหูมากอ้ยยย เพราะมากมายเลยคั้บ ดีไปหมดเยย😊🎉,0,2023-03-25T13:53:59Z
@malx2032,เพราะมากกกก ชอบมากกกกกก 10/10/10 ❤,0,2023-03-25T13:53:56Z
@jenojam6159,💞💞💞💞💞💞💞💞💞,0,2023-03-25T13:53:47Z
@ssmileraa248,เซียวจวิ้นภาษาไทยชัดมากก พี่คุนก็เสียงละมุนเว่อ ส่วนเตนล์ไม่พูดมาก ขี้หูไหลเป็นทองแล้วตอนนี้😭💖,0,2023-03-25T13:53:42Z
@chanita3498,ว้าววเตนร้องเพราะมาก​ ร้องเพลงไทยอีกเยอะๆนะ,8,2023-03-25T13:53:25Z
@chanakarnjt8237,เพราะมากกกกก ลงตัว 真好听❤,2,2023-03-25T13:53:11Z
@watcdits6528,น้องเตนล์เสียงหวานมาก พรุ่งนี้พี่กินกาแฟไม่เติมไซรัปแล้วนะกินไปฟังเพลงนี้ไปกาแฟก็หวานแล้ว,3,2023-03-25T13:53:10Z
@channigf,هاينوت شياوجون!!,0,2023-03-25T13:53:02Z
@78HannaH78,Perfectly harmonized ❤,1,2023-03-25T13:52:38Z
@ouanphupha,ชอบบบบบบบบ❤,0,2023-03-25T13:52:34Z
@bestalrsa,มันดีมากอ่ะ กรี้ดแบบสิบรอบ,0,2023-03-25T13:52:34Z
@MiCha-md7xp,เขินเสียงเต๋อมากกกกดีไปหมดเนยยย,0,2023-03-25T13:52:32Z
@nakayumoto2697,This has gotta be one of the best NCT covers ever released!! I've been listening to various NCT covers lately while studying and this is def one of my faves!!,2,2023-03-25T13:52:29Z
@Sharon-pq4fz,เตนล์เชือดพี่ด้วยรอยยิ้มมากลูก❤❤❤,2,2023-03-25T13:52:28Z
@dolecollab,เก่งจังเลยคับเด็กๆของมี๊ ฮือ,0,2023-03-25T13:52:25Z
@phanuchnatd1768,โชคดีมากที่ท่อน 1:11 เตนล์ไม่ได้มองกล้อง ไม่งั้นตายเป็นตาย,2,2023-03-25T13:52:25Z
@taotao9547,งื้อเก่งอ่าาา ตามมาจากนักร้องข้ามกำแพง,0,2023-03-25T13:52:07Z
@jennychthchs,"I've been here for an hour and still can't move on from ten's mellow voice 😣💘
Ok. I will praise each member one by one
Kun, his voice is beautiful and he did a great job rearranged this song in such a perfect way. Thank you kun-pd!
Xiaojun, I can tell he practiced A LOT cuz his thai pronunciation is sooo goood! It's nearly perfect! His voice is powerful and fascinating. Hope he cover more thai songs in the future.
And my baby TENLEE! his voice, his emotion, his expression, his passion, literally everything about him is perfect! He is more than ready to have his very own thai song.(or at least a solo cover) Please make it happen! I NEED to hear ten sings in his mother tongue more PLEASE I'm begging you SM 😭",6,2023-03-25T13:51:59Z
@lauxol,Omg this is so beautifulll,0,2023-03-25T13:51:58Z
@veronicaguardado677,"Love it, your harmonization is beautiful together. My WayV boys ❤",3,2023-03-25T13:51:57Z
@i_m_henpunzel,"All of them did very well😭😭😭 My ears are truly blessed🥹💗💗💗 and finally A THAI SONG COVER😆😆😆 ((I envy u thai fans😭)) but rly tho this song is SUUUPEEEERRR SWEET AND THEIR VOICES COMPLIMENT EACH OTHER😭 Ten’s singing techniques are getting stronger, the runs are smoothhhhhhh! Xiaojun’s high note never fails tho, AND YEA KUN’S SWEET HONEY VOICE COMPLETES THIS COVER🥹🥹🥹 I’m proud of you my wayv bros!",2,2023-03-25T13:51:52Z
@ratimarungaroon.,เพราะมากกกกก🫠🫠🫠🫠ฮือออ,0,2023-03-25T13:51:51Z
@babellbalabell8606,คนแรกร้องชัดมากกกก,2,2023-03-25T13:51:39Z
@brightwin652,Woaaahhh❤❤❤❤,0,2023-03-25T13:51:37Z
@graciady,Keren keren keren,0,2023-03-25T13:51:19Z
@betahansell2656,"้่เป็นเซอร์ไพส์ที่ดีมากๆเลยคร้าบ มาไทยบ่อยๆนะคร้าบ 😘😘😘😘  มะเตนล์ คุนคุน เซียวเซียว และเววี่ 😍😍😍

น้องเตนล์ร้องได้ละมุน ยิ่งแสงภาพคืออบอุ่นมาก น้องเซียวร้องเพราะมาก พี่คุนร้องหวานมาก 

โชว์สกิลลูกคอมะเตนล์ไปกรุบ ดีงาม 

รักนะคร้าบบบบ",0,2023-03-25T13:51:16Z
@chayudayoonie7492,ดีมากดีเยี่ยมเยี่ยมยอดเยี่ยมที่สุด😭💗,0,2023-03-25T13:51:07Z
@sunhbrk,เต๋อร้องชัดมากนะ ร้องเพราะด้วย เสียงเต๋อทำเอาเขินนนน,0,2023-03-25T13:51:07Z
@nichanlllnn,คนไท๊ยยยยยยยยยยยยย ร้องชัดมากลู๊กกกกกกกกก,0,2023-03-25T13:50:56Z
@バッカスうずめぇふぺちゅニア,it was revealed🤟,0,2023-03-25T13:50:55Z
@astronaut0335,ดีมากกกกกก,0,2023-03-25T13:50:54Z
@lucianamariafernandesdealm1297,"Vou chorar,que lindo",9,2023-03-25T13:50:53Z
@myr9198,ดี เลิศ ประเสริฐ ไพเราะ มหัศจรรย์ ยิ่งใหญ่! โฮรร ร้องเพราะทุกคนเลยคับ แถมสำเนียงยังดีสุบ ๆ ทำนองก็ดี ตอนไฮโน้ตกับประสานก็อย่างปัง นั่งฟังไปยิ้มไป นอกจากรอยยิ้มแล้ว พวกพี่ก็เชือดหนูได้ด้วยเสียงเพราะ ๆ นั้นเลยค่ะ แงแง ❤,3,2023-03-25T13:50:47Z
@Mark-vh5bf,เซียวจวิ้นร้องชัดแบบตะโกน,0,2023-03-25T13:50:41Z
@KamilaDalmate,They all sound amazing. We love you Xiaojun Ten and Kun❤,38,2023-03-25T13:50:23Z
@aoeiing387,กลมกล่อมละมุนหูดีมากก,0,2023-03-25T13:50:15Z
@chamai9399,เพราะมากกกกกกกกกกกก,0,2023-03-25T13:49:56Z
@chomsuan13,เพราะจ้า.. เวลาฟังเพลงจะนึกถึงผับ หรือพวกคาเฟ่อะไรแบบนี้ แต่ก็นะ 5555,0,2023-03-25T13:49:54Z
@SujinunSrithong,หลงเสียงเซียวจวิ้นตั้งแต่ในคอน ❤❤,0,2023-03-25T13:49:52Z
@nika_nelson,"Красота
Хочется сидеть так светящейся палочкой махать",0,2023-03-25T13:49:51Z
@donachetry172,Kun and Xiaojun's pronounces are so good omg!! 💓,4,2023-03-25T13:49:47Z
@diegovera74,Ame,0,2023-03-25T13:49:44Z
@constantlyimproving2879,Tennnn????,1,2023-03-25T13:49:44Z
@qmelinz3194,💚💚💚💚💚💚💚,0,2023-03-25T13:49:41Z
@aoeiing387,talented,0,2023-03-25T13:49:34Z
@yuliafaroqi7956,OMG OMG OMG my heart is melted,0,2023-03-25T13:49:26Z
@kimonnee2751,กรี๊ดดดด ดีงามมาก งามมากที่สุดค่าา,0,2023-03-25T13:49:25Z
@rachasangchai5648,หืออออ เก่งมากกก ปริ่ม,0,2023-03-25T13:49:17Z
@jyn2986,หูละลาย โดนเววี่สาปให้ตายแล้วตายอีก🫠🫠🫠🫠,0,2023-03-25T13:49:06Z
@26กัลยวรรธน์รักษาพรม,เพราะมากๆๆๆ เริ่ดปัง ชั้นรักเวอร์ชั่นนี้ ขอบคุณที่ตั้งใจทำผลงานออกมาให้ได้ฟังนะค้าบบ,0,2023-03-25T13:49:04Z
@astronaut0335,เพราะมากๆๆๆๆ❤,0,2023-03-25T13:49:00Z
@wanwisalodmuangtha3981,อยากกรี๊ดดดดดดด,0,2023-03-25T13:48:56Z
@pineapplewaan6958,เพราะมากกก,0,2023-03-25T13:48:52Z
@smstan2656,Aaaa i like this song,0,2023-03-25T13:48:52Z
@2001.o_o,I can’t :(,0,2023-03-25T13:48:52Z
@astronaut0335,ละลายย,0,2023-03-25T13:48:45Z
@user-nf2do4fr6p,!!!!!,0,2023-03-25T13:48:44Z
@camycreams.0122,เสียงหวานปานน้ำผึ่งเดือน5🥹,0,2023-03-25T13:48:38Z
@user-nf2do4fr6p,Kereeennnn,0,2023-03-25T13:48:37Z
@cleartao3924,"Wow, WayV is surely a versatile group! Love their vocals here and it melts my heart",9,2023-03-25T13:48:26Z
@jyn2986,งู้ยยยยยยยยย,0,2023-03-25T13:48:25Z
@tshomework8867,Please let wayv vocal trio do more projects  together!!,3,2023-03-25T13:48:15Z
@_Hamburrger,กี้ดดดดดดดดดดดดดดดดด❤,0,2023-03-25T13:48:08Z
@Nurfadilah-zb4bj,Kunnn ge 😍😍😍😍,1,2023-03-25T13:48:09Z
@FullnamekhonrakPeeTEN1001,เธอเฉือดฉันได้นิ่มๆด้วยร้อยยิ้มเธอ,0,2023-03-25T13:48:07Z
@tibnanthiya,ต้องแบบนี้สิ❤,0,2023-03-25T13:47:54Z
@mikaela9902,WAYV VOCAL LINE DO NOT DISAPPOINS !!!!,8,2023-03-25T13:47:47Z
@imbam9884,เสื้อสีน้ำเงินคือใครคะ ไทยชัดมากแม่🫶🏻🫶🏻,0,2023-03-25T13:47:40Z
@MooMai34,"ดีมากกกก โวคอลเวย์วีไม่ทำให้ผิดหวัง
คุนเกอเก่งมาก เตนล์เก่งมาก เซียวจวิ้นเก่งมาก
🎉🎉🎉",0,2023-03-25T13:47:37Z
@SujinunSrithong,เมื่อฉันฟังเวอร์ชั่นนี้ก็ไม่สามารถพาเสียงกับไปเป็นคนไทยเเท้ได้😅 แล้วทำไมสำเนียงต้องร้องตามน้องด้วย😊,0,2023-03-25T13:47:34Z
@mikaela9902,I LOVE YOU TENNIE !!!!!,5,2023-03-25T13:47:30Z
@10velyluvlee10,เสียงนุจะทำให้ปลดล็อกสกิลแก้วหูทองคำ ดูชื่อช่องแบบดูแล้วดูอีกเค้ากินอะไรผิดสำแดงมารึป่าวทำไมทำตัวดี,0,2023-03-25T13:47:25Z
@Hyomi_Rose,เพราะมากกกกกกก,0,2023-03-25T13:47:24Z
@estera.s3202,💚💚💚 lindos! Tanto a música quanto eles!!,25,2023-03-25T13:47:16Z
@มะลิมีทองคํา,เด็กๆเชือดพวกเราด้วยน้ำเสียงเพราะๆพร้อมรอยยิ้มละมุนละไมไปเลยค่ะ คุณขาาาาาาาา,1,2023-03-25T13:47:11Z
@y0uu_naa,นึกว่าคนไทย3คนร้องด้วยกันซะอีก,1,2023-03-25T13:47:10Z
@firstsuh1757,finally the wait is over !!! TEN's vocal is really good !! I want more of his songs !!,40,2023-03-25T13:47:08Z
@Mykuromiten,TENLEE makes me melt ❤,8,2023-03-25T13:47:06Z
@sakuntalasoonsook5613,ดีมากกกกกกกกก❤,0,2023-03-25T13:47:04Z
@atcharasongkorn3353,ดีมากดีเลิสมากๆตัวพ่อตัวแม่เขามาแบ้วค่าอร้ายยยย,0,2023-03-25T13:46:54Z
@shiirojung4124,Ten’s voice is so beautiful and perfect,141,2023-03-25T13:46:49Z
@tenlee-zw6dj,เหมือนโดนสาปให้ยิ้มตลอดทั้งคริป เสียงทั้ง3คนออกมาดีมากละมุนนีเว่อๆพี่เต๋อกับพี่คุนสำเนียงไทยชัดทากๆๆ❤💕,0,2023-03-25T13:46:47Z
@zerosurtrying,เพราะมากๆๆๆๆๆๆ❤❤❤❤❤❤❤❤❤❤,0,2023-03-25T13:46:46Z
@ch4dj3n45,ภูมิใจๆๆๆในตัวเววี่,0,2023-03-25T13:46:45Z
@petraral638,เหมือนจะตุยเลยน้องเพราะเกิ้นนนนหูเคลือบทองงง,0,2023-03-25T13:46:41Z
@herehyam,น้องเตนล์ร้องดีมากกก เนื้อเพลงตรงกับน้องเตนล์มาก น่ารักยิ้มหวาน💖💖,7,2023-03-25T13:46:37Z
@nong1411,ตายเป็นล้านรอบก็ยอม,0,2023-03-25T13:46:29Z
@beenf2115,Ten voice OMG 😱 you're just absolutely amazing 😍,35,2023-03-25T13:46:23Z
@krnfaith,This is so goooooooood. I’m literally MELTing ❤ Ten’s voice and that ad lib are INSANE. My gosh Ten you melted my heart.,47,2023-03-25T13:46:23Z
@deboralumbangaol1294,💟💟💟,0,2023-03-25T13:46:17Z
@ohvp1sojpv-gi6ed,เสียงเตนล์ตอนเริ่มคือหูเคลือบทองของจริง เสียงหวานละมุน ชวนฟังเหลือเกิน ท่อนกลางๆ ก็ไต่ระดับความหวานจากหวานทุ้ม เป็นหวานแหลมรื่นหู ขึ้นเสียงสูงจนถึงไฮโน้ตที่โคตรให้เกียรติต้นฉบับ ไต่โน้ตทำออกมาได้ดีมากๆๆ ไลน์ประสานก็กลมกล่อม ลูกเล่น ลูกคอมาเต็ม งานสายตาก็ไม่เคยแผ่ว เป็นเตนล์ลีที่ครบเครื่องที่สุด all-rounder !!!,6,2023-03-25T13:46:13Z
@เด็กหญิงณปภัสร์ชูชื่น,ดีมากก ทุกคนเก่งมากเลยย😭😭,0,2023-03-25T13:46:07Z
@_jaokwang,ละลายจริงดีมากกกกกกก😳💗,0,2023-03-25T13:46:06Z
@Usernamepezz,เพราะมากเลยค้าบ หูเคลือบทองแย้วเคลือบเพชรด้วย🥹🥹🥹🥹🥹,0,2023-03-25T13:46:03Z
@asandrikarts,"WayV, you guys have done your best. I love you guys singing this song. You guys make me want to learn Thai and Chinese. I want to try to start learning Thai slowly.",5,2023-03-25T13:45:43Z
@813pages,So proud of my main vocalist Ten ❤ Kun and Xiaojun did great too,21,2023-03-25T13:45:28Z
@sawakokuronuma6479,แงงงง ตายแล้วตายอีกแล้วช้านนนนนน น้องจุนนนนนนน🫠🫠,0,2023-03-25T13:45:27Z
