video_id,comment_id,author,author_channel_id,text,like_count,published_at,parent_id,reply_count
BfsVafvcQ4k,UgxHgcHYM8FI1pWkCih4AaABAg,@leeongl3652,UCjcqHtDwkw9ZFSm2IfJnOWw,We love you forever ❤️ can’t wait to see you in India 💟🥲🫶 see you soon leadernim,0,2024-09-24T21:23:52Z,,0
BfsVafvcQ4k,Ugw17gTwMDI7ARI6hxl4AaABAg,@exoexol3867,UCfuUjBL1KTh0HE3eRQ5LgWQ,"‏‪20:39‬‏ 
Thank you for being our Suho. Thank you for being EXO.Thank you for being our leader.. Thank you for being shelter erie and all EXO members'..... Just thank you, thank you",0,2024-09-24T21:19:52Z,,0
BfsVafvcQ4k,UgwyCdD1Rt_i-x4agVF4AaABAg,@exoexol3867,UCfuUjBL1KTh0HE3eRQ5LgWQ,T^T ‏‪20:02‬‏,0,2024-09-24T21:05:14Z,,0
BfsVafvcQ4k,Ugzq8psBvqHq4jiD-TB4AaABAg,@exoexol3867,UCfuUjBL1KTh0HE3eRQ5LgWQ,"Chanyeolie the excited kid and the shy EXO kids are proud of their leader Suho T^T ‏‪18:40‬‏ 
 I'm still waiting for this video to be released Chanyeolie T^T",0,2024-09-24T20:58:34Z,,0
BfsVafvcQ4k,UgyzYLl0r9dDyIoLFkV4AaABAg,@exoexol3867,UCfuUjBL1KTh0HE3eRQ5LgWQ,Chanyeol for Suho and Suho for Chanyeol T^T,0,2024-09-24T20:55:33Z,,0
BfsVafvcQ4k,UgxC0WpRwu5Vsfmj62Z4AaABAg,@dokhtaremahtab,UCKNh7BiBCk2hJliAM_MiViA,We Exo-L love you so much and we always will be there for you SUHO.,2,2024-09-24T20:02:56Z,,0
BfsVafvcQ4k,UgxD6fgfzHUBp01LS2d4AaABAg,@zainabrabiugamawa1297,UCVX5OvBuoDJ5nASD1e7bULQ,❤❤❤❤❤❤❤❤,0,2024-09-24T19:46:22Z,,0
BfsVafvcQ4k,UgyDkDqeZe12-AO5AjF4AaABAg,@tevakamechal576,UCsCAnVvGnOAuFmG1WUU0tig,Go get dem BOSS…ur one of a kind🥰🥰🥰🥰,0,2024-09-24T19:25:18Z,,0
BfsVafvcQ4k,Ugwtm2xxFWWUIyTnhnx4AaABAg,@SH522-1,UC2Cg8T9nmz19EC9lObTze3A,"웃으며 보다 마지막에 눈물파티😢
준면아 영원이란게 있으면 진짜 우리 얘기일거야!
앞으로도 우리 오래오래 사랑하자❤
태어나줘서 고맙고 가수해줘서 고맙고 엑소해줘서 고마워 사랑해❣️",2,2024-09-24T19:05:19Z,,0
BfsVafvcQ4k,UgxdPuPj5DnUtN8I4v14AaABAg,@user-tk137,UCudo8nVMHj_6WZC-xta0W5g,❤❤❤❤😊,0,2024-09-24T19:03:22Z,,0
BfsVafvcQ4k,Ugzl83xcAwzbSrFwtkB4AaABAg,@RoothSmith,UCL_QS25Be87b602kWkFqmkQ,13:30 His smile soooo adorable 😍🐰🥰,1,2024-09-24T18:39:23Z,,0
BfsVafvcQ4k,UgzvdjM0FYxAN78J1nB4AaABAg,@khazapa,UCR0_22snNuFmUtfWd2YP7_w,I love him he is so humble and special to me,4,2024-09-24T18:29:08Z,,0
BfsVafvcQ4k,Ugy_y_Dk5kl3HV5noyZ4AaABAg,@RoothSmith,UCL_QS25Be87b602kWkFqmkQ,I miss long hair suho🥺🐰,0,2024-09-24T18:25:09Z,,0
BfsVafvcQ4k,UgzSfxmedSWTrhe64z54AaABAg,@Sarah_Kim_luv_Kai,UCfV6ZuRCMsmxQVOYiPFrI6g,Our bunny Suho there is a forever for us.,0,2024-09-24T18:17:28Z,,0
BfsVafvcQ4k,Ugx2GPGo64BAjg5ww8l4AaABAg,@northarea1203,UCeIZ7z1lHoXF0fso8pNl32Q,Suho baby,1,2024-09-24T18:14:29Z,,0
BfsVafvcQ4k,UgwMnDOckZB445YluQB4AaABAg,@exossion,UCKkEukt5nPsTUnPg_6d3XBQ,"""if there's a thing as eternity, i hope it's ours"" kim junmyeon, i love you so much",0,2024-09-24T17:59:52Z,,0
BfsVafvcQ4k,UgxxriPRBl4hN6ft15N4AaABAg,@joannaatacz3007,UCuH6IFncEf4gmuoe396JgmA,Poland waited so strong for to see him but concert had be canceled and we are very sad 😢😢😢,0,2024-09-24T17:59:36Z,,1
BfsVafvcQ4k,UgxxriPRBl4hN6ft15N4AaABAg.A8mI8lFzX-uA8nXuux1exi,@lovingmyselfright,UCJzIkwuUQYCwFLjVfIWGixg,I am just wondering why the shows were cancelled. Did the tickets not sell? Was there an issue with venues or what? I am so confused.,0,2024-09-25T05:36:38Z,UgxxriPRBl4hN6ft15N4AaABAg,0
BfsVafvcQ4k,Ugx3aWMghJz67RYovVd4AaABAg,@meitanti463,UCTPFABM-j-OMFGGIeZEyy8g,"Chanyeol tu selalu godain suho, tp dia gitu tu aslinya caper pengen nyari perhatian ke hyungnya wkwk",1,2024-09-24T17:57:15Z,,0
BfsVafvcQ4k,UgwdQPoWCzzkUVwrOWN4AaABAg,@nazwabasalamah516,UC8BkjEd9AGZX28BomkGeQtg,❤,0,2024-09-24T17:55:29Z,,0
BfsVafvcQ4k,UgzW_n5Y8lfuAyDH1p54AaABAg,@exossion,UCKkEukt5nPsTUnPg_6d3XBQ,suyeol TT the cutest,0,2024-09-24T17:54:59Z,,0
BfsVafvcQ4k,UgxK89SLXFKeLGT2Yjx4AaABAg,@exossion,UCKkEukt5nPsTUnPg_6d3XBQ,"junmyeon is such a hardworking person. thank you for suhome. it was amazing! I'm expecting even more for the future, let's spend more time together and come to Europe too :(",0,2024-09-24T17:54:48Z,,0
BfsVafvcQ4k,UgwTJ4AZYtr7ks3shwR4AaABAg,@BecauseOfHim1111,UC9q6qX9ygClG9YlHnPEvbPg,Suho is so handsome with a beautiful voice unlike any other.,9,2024-09-24T17:36:57Z,,1
BfsVafvcQ4k,UgwTJ4AZYtr7ks3shwR4AaABAg.A8mFYnaieBHA8n9GiUmyGV,@ksaewa1975,UCnVDkU0ZwfbbvJM4FrPLVuw,Agree,2,2024-09-25T02:01:18Z,UgwTJ4AZYtr7ks3shwR4AaABAg,0
BfsVafvcQ4k,UgyFiriIAf_0YJedHap4AaABAg,@noeyoes2,UCX86-M-1-z8K1pjJAzTAKiw,영원이란 게 있다면 우리의 얘기일 거야🐰💙,2,2024-09-24T17:35:18Z,,0
BfsVafvcQ4k,UgxGBhJlVgnfCjxHqR94AaABAg,@user-hyunee506,UCoS4_5YSFv3LWMJuqQw9X9Q,"이거 보니까 또 울컥하네
준면아 단언컨데 내가 가 본 콘서트 중에 제일 행복했고 너무 잘 놀아서 너무 좋은 추억이 됐어
특히 커튼때 운 좋게도 내가 딱 준면이 바로 앞이었어서 그 순간만큼은 준면이랑 단 둘이 있는 느낌이었어 ㅎㅎ 그거 기분 되게되게 좋더라
준면이가 준 이틀간의 꽉 찬 행복, 감동, 추억, 사랑 진짜 잊지 못할거야 
태어나줘서 고맙고, 내 청춘을 함께 해줘서 너무너무 고마워 사랑해 보고싶다😘",10,2024-09-24T17:21:14Z,,0
BfsVafvcQ4k,Ugx3PbOoWSU7sSy7-Xt4AaABAg,@ren.the.rascal,UCs5ktnbRQ5f-nmdXu6DajsA,"SUHO leadernim 🩵 know that your are the most handsome, vocally talented, kind, best leader in the whole wide universe. EXO-L  bunnies love you forever!!! 

We are one. Saranghajaaaaa!!!",0,2024-09-24T17:08:21Z,,0
BfsVafvcQ4k,UgxpvJO085wj4YBPj7x4AaABAg,@katieahn4018,UC40OmGF3544MEv0bEz8cTJg,"일본투어 잘 마치고 우리 또 한국에서 만나요❤ 사랑해😊
수홈같은 멋지고 감동적인 콘서트 제작하고 공연해줘 너무 고마워요!  제 인생 최고의 콘서트예요",1,2024-09-24T17:08:07Z,,0
BfsVafvcQ4k,UgwQ3Zo8x3NgLleredZ4AaABAg,@Seli0kk,UCvXJVgXLyafreBkswxa9sIA,He is so amazingg😭😭I am exol just a year but I know I will support you forever Suho💙,2,2024-09-24T17:06:55Z,,0
BfsVafvcQ4k,UgxnamCbfX_Q46hmvMN4AaABAg,@mira-1485,UC6RX52FWV6Yn3QWUWSP6d1A,my lovely Super Rock Star,0,2024-09-24T17:06:36Z,,0
BfsVafvcQ4k,UgzilorcTRg_pPFcjel4AaABAg,@aeriexol1485,UC7hRwkIPle-5GpDL2WrGuWw,"So proud of you leadernim, You're the bestttttt!!",0,2024-09-24T17:05:10Z,,0
BfsVafvcQ4k,UgxFzcqeLBcx7Lt03G14AaABAg,@ZR-tj6bh,UCGYppwqD_NOmTXDZCu303bw,"Какое душевное видео!
Спасибо!
Люблю всегда EXO, люблю тебя Сухо!❤",0,2024-09-24T16:54:08Z,,0
BfsVafvcQ4k,UgwJzdkS5UCA01FrHV14AaABAg,@nyeinsan2604,UCo2N8mZ85YnP0Fsodl4Lg7w,"My lovely man,You are all perfect for bunnyzens or tobeaks.",0,2024-09-24T16:45:56Z,,0
BfsVafvcQ4k,Ugz_CSMpW7lB09XtOLx4AaABAg,@꼬다리56,UC1r6fg99hdPg33ULBFdw7Hg,콘서트때 새록새록 기억난다ㅠ너무 좋았는데,4,2024-09-24T16:44:32Z,,0
BfsVafvcQ4k,UgxkbHy_F-2doH6Rieh4AaABAg,@dwikartikakusumandari,UCLaauputlaRi-IeEFNIDDWA,"Your hair during rehearsal 😍.. the concert hall seems convenient.. felt like so close with you 🤍.. if I knew the concert in Düsseldorf would be cancelled, I'd watch live through Beyond Live 💜",0,2024-09-24T16:44:22Z,,0
BfsVafvcQ4k,Ugz51U5oo1Rr0oZwmzB4AaABAg,@simaL-eu2jz,UCVZV7XjZVVWdvXLkCMDcHpg,"thank you for your hardworking
you always do your best
love you so much
saranghaja",0,2024-09-24T16:24:30Z,,0
BfsVafvcQ4k,UgzWzgAqgsiud5YwA354AaABAg,@claraquintero5047,UCEhDk9RXoBbeKxDtR6-Ml5w,SUHO GRACIAS POR MOSTRARNOS EL DETRAS DE CAMARAS DE TU CONCIERTO..  Y VER PARTE DE EL EN VIVO.. SUPÉR VER A CHANYEOL.. UN REGALO PARA MI QUE SOY DE LATINOAMERICA Y SUEÑO VERTE A TI YA EXO EN UN CONCIERTO.. MUCHO SUHO EXO LOS AMO 🫰❤️🫰,0,2024-09-24T16:22:28Z,,0
BfsVafvcQ4k,UgzWGIK3sR_sG5Fzv9d4AaABAg,@saniyamansoori9680,UCAinSzoM-sSwC1DVMLunFsw,Thanku chanyeol for coming and for  your support to Suho ❣️❣️,0,2024-09-24T16:21:34Z,,0
BfsVafvcQ4k,Ugwro5St32D7mYPVaJh4AaABAg,@saniyamansoori9680,UCAinSzoM-sSwC1DVMLunFsw,Thanku Junmyeon for working hard✨✨,0,2024-09-24T16:20:16Z,,0
BfsVafvcQ4k,UgxgqhSyBmXoVEMpKFN4AaABAg,@ref0522,UC7vVrSlBxk0ySMDP5KTJfeA,The cameramen always shoots from the best angles not gonna lie 🥺,2,2024-09-24T16:19:48Z,,0
BfsVafvcQ4k,UgxSt8ri2jTIcXKN8XF4AaABAg,@ref0522,UC7vVrSlBxk0ySMDP5KTJfeA,"I have so much to say that I've kept in my mind since the last time we talked. Things that I haven't been able to say to you due to time constraint and my nervousness. 

I tell you this, YOU make such great songs. Truly! The day I was finally free enough from my college back in 2022, I checked on you again to see you releasing new mini (Grey Suit). I also checked out your 1st mini (Self Portrait 자화상). My first impression was ""OMG! I'm really happy that he does rock like this... Because my comfort songs are mostly rock!""

And I thought you were gonna branch out to RnB or dance songs in your 3rd album. It turns out you released another rock album!! 점선면 is such a treat to my ears...

You always release something that's even better than your previous ones (that's already great!). You actually take the saying of ""Tomorrow, I'll be the better version of myself,"" to your heart, don't you 🥺

You and your contents had been with me during my job hunting that was so tiring and made me quite hopeless.

Nowadays, your content is my stress release from my tiring work. Keep doing this, okay!! I hope both you and I can still have fun together for more decades to come 🥰

Again, thank you so much 🐰💕",0,2024-09-24T16:17:55Z,,0
BfsVafvcQ4k,UgzR9IH4QGeKxyDI2e94AaABAg,@exo-lchannel,UCsGKVlLxSw2-F2_9YiTHu-g,올해 수홈 너무 행복했어 ㅠㅠ 올만에 다시 보니까 그때 행복했던 감정이 다시 올라온다 … 그때 스탠딩 뒤쪽에서 키작 엑소엘들 준면이 중앙무대로 나와야 환한 얼굴 겨우 겨우 잠깐 보였는데 나올때마다 너무 잘생겨서 감탄하고 넋을잃고봄 그때 양옆으로 첨보는분들인데도 에리들 다 가족같구 재밌었음 ㅋㅋㅋㅋㅋ 준면이 너무 착해 노래 너무잘해 ㅠㅠ 아니 댄서들도 없고 혼자 저렇게 3시간 무대 꽉꽉 채운다고용!!! 💛🩷💚🩵🧡 사랑하지않는법 나 몰라…..,9,2024-09-24T16:15:50Z,,0
BfsVafvcQ4k,UgzdSI2GfKtDBlf8h294AaABAg,@Jamilya_0522,UCkswsxhEjs8IMVAJl2paS-A,준면아~~~ 너무 너무 너무 사랑해 ~~~ ❤️❤️❤️,2,2024-09-24T16:15:04Z,,0
BfsVafvcQ4k,UgxbQQx13iAA4inP5ot4AaABAg,@ratihm2_,UC3iXWDv0GAZ0zn_THpfe1Dw,miss you😢,0,2024-09-24T16:15:02Z,,0
BfsVafvcQ4k,UgyxcAtk_PF7VQoHP494AaABAg,@sara.fav801,UCbRzmyA5pqlBjeqG9oEA3sg,Still sad that they canceled the whole Europe leg,0,2024-09-24T16:09:46Z,,0
BfsVafvcQ4k,UgwmXQCr75nNzXKi_gp4AaABAg,@bbiyakk,UCvk-fvzUrU2pG0c0ow9etxQ,영원이라는게 있다면 그게 우리 얘기야 사랑해 준면아❤,3,2024-09-24T16:09:38Z,,0
BfsVafvcQ4k,UgywHBlo9uWk28AYZX54AaABAg,@tehnha4982,UCucjR-U4jzU2w31dJD0afMA,"Terimakasih leader nim atas kerjakeras nya atas lagu2 indah nya, kami eri selalu mendukung, tolong jaga kesehatan dengan baik dan mari kita bertemu lebih lama lagi, aku cinta kamu.",7,2024-09-24T16:07:35Z,,0
BfsVafvcQ4k,Ugw93v-GvuEOmQdiCDN4AaABAg,@kmlxza,UCyA2ZGMkEcm_OCim2cLntSQ,"Proud is an understatement. Junmyeon-ah I respect you and your art, thank you for sharing it with us. 사랑하자!",16,2024-09-24T16:06:11Z,,0
BfsVafvcQ4k,Ugz2hjhEbbpKVCKUFxB4AaABAg,@tehnha4982,UCucjR-U4jzU2w31dJD0afMA,"My Multitalented Kim junmyeon, we luv you so much",6,2024-09-24T16:05:09Z,,0
BfsVafvcQ4k,UgzMG1bqyDQ7fjbrCmR4AaABAg,@tehnha4982,UCucjR-U4jzU2w31dJD0afMA,"I'm made in you and you made in me, let's luv forever, much luv for u leader nim n thank you for being in my life.",6,2024-09-24T16:01:58Z,,0
BfsVafvcQ4k,Ugwza7xGjjwmr1foKAN4AaABAg,@marlitanggalon227,UC2-i-wxIOr3dahLxykvn2BA,I am so proud of you Myeonnieeee❤️🫰,0,2024-09-24T16:01:37Z,,0
BfsVafvcQ4k,UgzKL8SY8HaOF3GbFbh4AaABAg,@junmyeonkim7347,UCtN9530PH8XuR-NxrNOWffA,Junmyeon you’re the best!!!!!,0,2024-09-24T16:00:05Z,,0
BfsVafvcQ4k,UgwDcoI-wZsg7VUBDdV4AaABAg,@yanancotton7287,UCS9WTsZGGkk4d9tfd9v2cTw,"I love you SO MUCH, Kim Junmyeon",0,2024-09-24T15:55:27Z,,0
BfsVafvcQ4k,UgzgtsRCHa3CLCrQm4d4AaABAg,@tomtom-qn6mq,UCADxDAIIo1GneB7J7pXEk1Q,سوهو❤❤,0,2024-09-24T15:53:03Z,,0
BfsVafvcQ4k,UgwX5oLj9jmeXvE7Mmp4AaABAg,@silviasilva3634,UCBtWowSu_o-zArddqc3SsLg,Subo es realmente increíble estoy muy orgullosa de Él.,0,2024-09-24T15:50:51Z,,0
BfsVafvcQ4k,Ugy6d1XLacd4FLFI-kd4AaABAg,@jins1010,UC93qhGh9Y0wTAW8VrYOfyrA,나의 별 준면아 첫 솔콘 정말 반짝반짝하고 눈부셨어❤ 난 너의 10대도 20대도 그리고 30대에 이어 너의 평생를 응원하고 사랑할께😊,3,2024-09-24T15:50:02Z,,0
BfsVafvcQ4k,UgxKbYTb9QVWgDfW6aJ4AaABAg,@adjasidibe8413,UCFcGEi6DaoeAtzKT259QFbQ,Awww SuSu pretty special awesome,0,2024-09-24T15:41:32Z,,0
BfsVafvcQ4k,Ugw8lHjdnkrC4-awKa54AaABAg,@krizylmoreno7233,UCKQqIRv0Pjra4CV-lN8hmfA,I miss SUHOME 😭 I miss u Junmyeon!,1,2024-09-24T15:41:30Z,,0
BfsVafvcQ4k,UgxzEjfEk2yD0yxhkP54AaABAg,@nivea0707,UCUtjzn-gozMQUjAcNg13BgQ,スホヒョン会いに行くよ！,0,2024-09-24T15:36:47Z,,0
BfsVafvcQ4k,UgxzTWEyaYaS2dkpFDl4AaABAg,@weareone2012L,UCcc8620UIot3tc5gygHxvlA,Love from 🇮🇱❤,0,2024-09-24T15:36:20Z,,0
BfsVafvcQ4k,UgyJKYvv5C3xOjJWyQV4AaABAg,@dieneuniqlo8487,UCFwJrRff4gn5M6vKrAbzDtA,,0,2024-09-24T15:35:44Z,,0
BfsVafvcQ4k,Ugy9YP1QyP2yLmiIJyF4AaABAg,@laurasmelodies,UCHPF3jHsj2WU9u2l-wT2axQ,suho and sb are the best!,0,2024-09-24T15:35:00Z,,0
BfsVafvcQ4k,UgzdQ39ST8u9a7RFmPd4AaABAg,@laurasmelodies,UCHPF3jHsj2WU9u2l-wT2axQ,"everyone whe went to suhome says it was one of the best concerts they ever been to, suho is really amazing",1,2024-09-24T15:34:42Z,,0
BfsVafvcQ4k,UgyXwXdeAKzHKi1iqql4AaABAg,@lauriegonzalez2374,UCVK0cjxUSFCU5IwMsJOLinw,"The day i'll be fortunate enough to meet him, i'd like him to write down for me the last sentence he said...❤❤",0,2024-09-24T15:34:10Z,,0
BfsVafvcQ4k,UgzY0mpDVqRGs6pL9-h4AaABAg,@laurasmelodies,UCHPF3jHsj2WU9u2l-wT2axQ,"Suho is such a perfectionist, no wonder su:home is so great",9,2024-09-24T15:33:38Z,,0
BfsVafvcQ4k,UgzxvRnMgqasHPOJiH14AaABAg,@ngaiNgai-r9p,UCZxR6_tOWNP4qyUbmEja36Q,love you SUHU,0,2024-09-24T15:33:34Z,,0
BfsVafvcQ4k,Ugw9MX0-uT79I55qBq54AaABAg,@ngaiNgai-r9p,UCZxR6_tOWNP4qyUbmEja36Q,사랑 수호,1,2024-09-24T15:33:28Z,,0
BfsVafvcQ4k,UgxGfE7JXakgHTp7WYV4AaABAg,@ngaiNgai-r9p,UCZxR6_tOWNP4qyUbmEja36Q,사랑 수호,0,2024-09-24T15:33:28Z,,0
BfsVafvcQ4k,UgwRUMtANm-wy8M_jgl4AaABAg,@ngaiNgai-r9p,UCZxR6_tOWNP4qyUbmEja36Q,사랑 수호,0,2024-09-24T15:33:27Z,,0
BfsVafvcQ4k,UgxaV-WodNR9X_4GFt94AaABAg,@ngaiNgai-r9p,UCZxR6_tOWNP4qyUbmEja36Q,사랑 수호,0,2024-09-24T15:33:15Z,,0
BfsVafvcQ4k,UgxSBH5NqWvTvrHrPd14AaABAg,@laurasmelodies,UCHPF3jHsj2WU9u2l-wT2axQ,Suho's amazing!,0,2024-09-24T15:32:43Z,,0
BfsVafvcQ4k,UgyG7uaAt0n8dHAjT0l4AaABAg,@laurasmelodies,UCHPF3jHsj2WU9u2l-wT2axQ,Guitar player Suho is so cool!,0,2024-09-24T15:32:28Z,,0
BfsVafvcQ4k,UgwIhN9nvTCAcHXhlHp4AaABAg,@laurasmelodies,UCHPF3jHsj2WU9u2l-wT2axQ,so cool!,0,2024-09-24T15:31:54Z,,0
BfsVafvcQ4k,UgzQf-TUBXbuvLLB8Th4AaABAg,@laurasmelodies,UCHPF3jHsj2WU9u2l-wT2axQ,COME TO BRAZIL,0,2024-09-24T15:31:36Z,,0
BfsVafvcQ4k,UgxQe9hjzKIIlGVJQZR4AaABAg,@laurasmelodies,UCHPF3jHsj2WU9u2l-wT2axQ,What?! Omg! Thank you!,0,2024-09-24T15:31:24Z,,0
BfsVafvcQ4k,UgwFNj1QSiBjveSgKm54AaABAg,@jheniferhauck,UChtKoliHdtE1nHorFzLqj8A,"So dedicated, precious Junmyeon.. I am waiting for you",0,2024-09-24T15:27:22Z,,0
BfsVafvcQ4k,UgzEA3z8e6_4X8jXI8B4AaABAg,@maoreenkhln,UCTD8cJ3ue-uJxvQywp0WxFA,"i love you, always.",0,2024-09-24T15:22:05Z,,0
BfsVafvcQ4k,Ugw_nJDotwpTI6o-yrZ4AaABAg,@jomariemmanuel,UCybvSVG07ZGkOHrFJUe8PQw,"WE LOVE YOU, BUNNYMYEON! 😘🐰💙🩵🤍",3,2024-09-24T15:18:03Z,,0
BfsVafvcQ4k,UgzwJBLDS_1-FxS6CpZ4AaABAg,@ja-sn7es,UClbyuLBWQkjzg_Q4xTEkPmw,So talented! A true artist,0,2024-09-24T15:14:38Z,,0
BfsVafvcQ4k,Ugwo8_7mluWTYuFapsJ4AaABAg,@Laaammee,UCdCus7p9JxmvPFqW6PsDgeA,💕,0,2024-09-24T15:10:15Z,,0
BfsVafvcQ4k,UgwF9eyPoHflC5sG1rF4AaABAg,@sarahdemioko1021,UCIHO_nf_NdypoOz6-tkxF3g,"Us european fans didn't get to see you 😢, but I hope you had fun I'm still happy for you SUHO. Keep Sulaying 💗🗣",0,2024-09-24T15:06:13Z,,0
BfsVafvcQ4k,UgyuFO7tk67bH4GKr2d4AaABAg,@Ryeong24,UC2xuK1ToU0A8ca_Bl9rW2tg,Junmyeonnaaa saranghaaeee 😭😭🤍🤍🤍,0,2024-09-24T15:05:21Z,,0
BfsVafvcQ4k,UgzrINBIkgauXBdmIHR4AaABAg,@eva-lottaroache4509,UCbOImylTzqUjNk85qibHWSA,"Suho, king of vocals and of my musical orientation! ♥️❤️💕 Love you forever from Sweden 🇸🇪",0,2024-09-24T14:59:21Z,,0
BfsVafvcQ4k,UgydOHPDegPxp-QBfaN4AaABAg,@IanThy-ft8dm,UCSxppVedzM3bUSjFLutNFAA,I miss you a lot BunnySuho😭🐰💙,0,2024-09-24T14:56:55Z,,0
BfsVafvcQ4k,UgyuqGe7aPmRM_6G_Z94AaABAg,@ja-sn7es,UClbyuLBWQkjzg_Q4xTEkPmw,I miss his long and fluffy hair,0,2024-09-24T14:55:29Z,,0
BfsVafvcQ4k,Ugw-xNnbSNisC-7FjqJ4AaABAg,@WithBunnies-t1w,UCj9yPDgkrIb_ZZP8QsstVeA,JUNMYEON AH SARANGHAE,0,2024-09-24T14:55:19Z,,0
BfsVafvcQ4k,UgxPv9kmRiyjni9NEmt4AaABAg,@nadjajukova55,UC8q0IpHFpkvVVFQbKb3jNDg,🌻🍁🌷🌹💐👍❤❤❤❤❤❤!!!!!,0,2024-09-24T14:51:25Z,,0
BfsVafvcQ4k,Ugy_FcIOppYA0gcAcKB4AaABAg,@Superstarjing,UCIvxl3AKRBdwKtg_1R8a6WA,宝宝要永远开心，我爱你,0,2024-09-24T14:48:17Z,,0
BfsVafvcQ4k,Ugx034c3CjLCnh7ezVZ4AaABAg,@Ryeong24,UC2xuK1ToU0A8ca_Bl9rW2tg,Suhome really looks fun ㅠ,0,2024-09-24T14:43:51Z,,1
BfsVafvcQ4k,Ugx034c3CjLCnh7ezVZ4AaABAg.A8lwk2kdA1LA8lya0WtY39,@Ryeong24,UC2xuK1ToU0A8ca_Bl9rW2tg,whatt I didn't know giri boy came?..,0,2024-09-24T14:59:58Z,Ugx034c3CjLCnh7ezVZ4AaABAg,0
BfsVafvcQ4k,UgxfYoC8VHYxqegL5XN4AaABAg,@bt1137,UC2CoPdjmXTt2h5LCrXUE7Cw,I'm so proud of you and I'm so proud to be your fan. I love you.,3,2024-09-24T14:42:27Z,,0
BfsVafvcQ4k,Ugzh3w6PGWzHsB2OANh4AaABAg,@Nafiosy,UCVhOe5LryLf76FCV4siTQ6Q,Exo is best,0,2024-09-24T14:41:10Z,,0
BfsVafvcQ4k,UgyQFlF5chC47oUqqvF4AaABAg,@nafiran2206,UCKRTarkEaIy3YqJTVs5sjpw,being loved❤,0,2024-09-24T14:39:43Z,,0
BfsVafvcQ4k,UgxhwsbOI-pbhLQnWId4AaABAg,@kokiri8819,UCzvQrZqPly1lBO3jlCFgwTw,"TE AMAMOS SUHO. ERES UN SER MUY ESPECIAL PARA EXO-L Y PARA NUESTROS EXO. 
ERES EL MEJOR LIDER. 
AMAMOS TU GRAN TALENTO TAMBIÉN.",0,2024-09-24T14:33:32Z,,0
BfsVafvcQ4k,Ugx1I2oEAmyUdOpQFap4AaABAg,@jessicasycca1176,UCKNasa0N-1h3RorARy6QBaQ,"""If theres a thing ETERNITY, I hope its OURS""
YESSS!!💯 We say in union for our precious leader Junmyeon❤️✊",2,2024-09-24T14:32:42Z,,0
BfsVafvcQ4k,UgymE_7-4hnL7kN-Hsp4AaABAg,@khaliqpatah,UCT_olnm37ERx6-IOVBYViQw,SUHO IS THE BEST! 100%❤❤❤❤❤❤❤❤,0,2024-09-24T14:30:15Z,,0
BfsVafvcQ4k,Ugz_Zve7x6ZW24-PHU14AaABAg,@Juhyun_1607,UCOdFthFv8p_eILPeQpAfyuA,"2024년을 행복한 해로 만들어줘서 고마워!!
영원이라는 게 있다면 우리 얘기야💙
앞으로도 응원할게 같이 오래 행복하자!",3,2024-09-24T14:27:17Z,,0
BfsVafvcQ4k,UgwiM_YdXNs8_BB0N_V4AaABAg,@CAiLeeN19,UCwxisikguvy9nIJRZHoCdMw,I'm so proud of you my love🤍,0,2024-09-24T14:26:17Z,,0
BfsVafvcQ4k,UgwiXkd6zBUTcXPjvOd4AaABAg,@sheerly0970,UCN4GVpKg9LJM8GGyjuEREAA,❤❤,0,2024-09-24T14:23:56Z,,0
BfsVafvcQ4k,Ugyo9ekRIbB8azPRA254AaABAg,@Rekha-s1c6f,UCtc5_gH3-4hgd_e3REjZs0w,I have no words for you 😊 you are great ❤❤,0,2024-09-24T14:23:48Z,,0
BfsVafvcQ4k,UgyxQ3X8ojouZTVOZnR4AaABAg,@ekswaizi,UCS81tr0smZOm-vCgckXWh4g,❤❤❤❤❤,0,2024-09-24T14:23:26Z,,0
BfsVafvcQ4k,UgzJwT2k1-65gMyetD14AaABAg,@ShereeMiñoza,UCc1-ywiCm72HMSufSwTK7nA,The sudden poem omg😂,5,2024-09-24T14:22:09Z,,0
BfsVafvcQ4k,UgynH-O0xahuGXN2PW94AaABAg,@SanpalOo-h1k,UChP8FQsVGoBglh-uJst2UUQ,"I'm crying, now. Forever is ours .",20,2024-09-24T14:19:59Z,,0
BfsVafvcQ4k,UgzABvuNUAUo3nXIXhp4AaABAg,@lolol1485,UCunDK3MdVsbM2G6YJp6BZKw,Kim Junmyeon the best ❤,7,2024-09-24T14:17:37Z,,0
BfsVafvcQ4k,UgzFjIt_AQ66USKtKFN4AaABAg,@Mona_ko_monako,UCVJeYAlOxV3PR6Wx237D1Kg,"𝚈𝚞𝚘 𝚊𝚛𝚎 𝚋𝚎𝚜𝚝 𝚕𝚎𝚊𝚍𝚎𝚛👍
𝚈𝚘𝚞 𝚊𝚛𝚎 𝚖𝚢 𝚋𝚘𝚢𝚏𝚛𝚒𝚎𝚗𝚍❤
𝚆𝚎 𝚊𝚛𝚎 𝚘𝚗𝚎 𝙴𝚇𝙾🤍🤍🤍🐰🐰🐰",1,2024-09-24T14:17:14Z,,0
BfsVafvcQ4k,UgyzCX2VX3P1QG7qnj54AaABAg,@lolol1485,UCunDK3MdVsbM2G6YJp6BZKw,I LOVE YOU KIM JUNMYEON!! SUHOME IS THE BEST CONCERT EXPERIENCED FOR ME!! REALLY!! LET’S MEET AGAIN SOON~ ❤,6,2024-09-24T14:16:59Z,,0
BfsVafvcQ4k,UgxkfHv4EIJKWjX3Lgh4AaABAg,@jessicasycca1176,UCKNasa0N-1h3RorARy6QBaQ,"You know how to play electric guitar now🥺 and you even learned English, Our leaderrr, Immm beyond PROUD!! ❤️✊ Your really amazing..",18,2024-09-24T14:16:21Z,,0
BfsVafvcQ4k,UgwXhfUbreosl4wQ_TV4AaABAg,@dareemdream,UCIdJ1-nbG4vOxwPfvc5kRqA,Junmyeon I love you so much ❤,5,2024-09-24T14:15:58Z,,0
BfsVafvcQ4k,UgyxgGKWZLK42JV7SE14AaABAg,@arianafitriyani987,UCtK3-LiZFXyJKqCUNkVC9tQ,Our bunny❤❤❤,1,2024-09-24T14:15:55Z,,0
BfsVafvcQ4k,UgwHin1kk4-QETAH9y94AaABAg,@claudiayukimiokaharamoresc1640,UCqJEY9v4Ab9UCV_O7OtFs9A,Precious Junmyeon ❤️💎🇧🇷🇧🇷,4,2024-09-24T14:13:18Z,,0
BfsVafvcQ4k,Ugxjwos1Vf7MmsCHxy94AaABAg,@jessicasycca1176,UCKNasa0N-1h3RorARy6QBaQ,❤❤❤❤❤❤❤❤❤,0,2024-09-24T14:13:06Z,,0
BfsVafvcQ4k,Ugxd_mtX-i6lkJVyppd4AaABAg,@정해인-k1g,UCypmsLR_LNb0RRVQyv1sVnw,함께라는 말이 참 잘 어울리는 아이돌,2,2024-09-24T14:12:25Z,,0
BfsVafvcQ4k,Ugxs1lZJ9Wnnu-ljKkp4AaABAg,@Dumdo_Kyoong,UC7shaq7Tu3GbMUO6J5xWK4Q,영원이란게 있다면 엑소와 엑소엘 얘기면 좋겠다.,0,2024-09-24T14:11:45Z,,0
BfsVafvcQ4k,Ugx_gjvQP68sBEJt1vZ4AaABAg,@SanpalOo-h1k,UChP8FQsVGoBglh-uJst2UUQ,Our Leader & Our Chanyeolie,2,2024-09-24T14:11:40Z,,0
BfsVafvcQ4k,Ugw8sOaUFjtlt1SODrB4AaABAg,@GNar522,UCGlmXJUwA0ZD4dcyWbccJzg,"SUHO is really our home. No matter who is your bias Suho has special place in everyone’s heart. SuHome really feels like home, relaxing comforting precious with genuine happiness and joy❤️",15,2024-09-24T14:09:18Z,,0
BfsVafvcQ4k,UgzNQPUNX9WDqnmgpsF4AaABAg,@Weareone-i9w,UC4QuVAMTeCgsqsL6A5PlGPQ,P'Jun ~~~~ I Miss U ❤💙,4,2024-09-24T14:07:29Z,,0
BfsVafvcQ4k,UgwnXLabPmLvXDybeRp4AaABAg,@milashawty1417,UCcusXQCBpBTn7A8Z9xsjmNg,"He is so precious. I love you so much, Kim Junmyeon",6,2024-09-24T14:07:12Z,,0
BfsVafvcQ4k,Ugy1K8DvUzA5rSIAXER4AaABAg,@礼央-m5f,UCi9b7_AXripDa8RVPaMU4Ow,永远在一起吧宝宝❤❤❤,3,2024-09-24T14:06:16Z,,0
BfsVafvcQ4k,UgyVW6jPj3VoJ3EhO0d4AaABAg,@礼央-m5f,UCi9b7_AXripDa8RVPaMU4Ow,俊勉啊❤❤❤❤,3,2024-09-24T14:06:04Z,,0
BfsVafvcQ4k,UgwxE1bMDKrlYlk2GVd4AaABAg,@tannybarnett2835,UCwQiD7zajNsS2Jna7veGakQ,❤❤❤❤,2,2024-09-24T14:04:05Z,,0
BfsVafvcQ4k,UgwXsEJcPYF31OZ8i0l4AaABAg,@ebem8193,UCA7OH59myxxGjKT6HYbZddg,SUPER DUPER PROUD OF YOUUUUU,3,2024-09-24T14:03:09Z,,0
BfsVafvcQ4k,UgymMSQ_uBsonf8XqZt4AaABAg,@Jiyuu_56,UC8Uom4U8ONJc2-Dyfa3I2ew,💙 준면이 사랑해 우린 늘 준면이 편 💙,0,2024-09-24T14:02:50Z,,0
BfsVafvcQ4k,UgxmFa_IgjS6y-NI_Dh4AaABAg,@ShereeMiñoza,UCc1-ywiCm72HMSufSwTK7nA,looooooovveeeee,2,2024-09-24T14:02:41Z,,0
BfsVafvcQ4k,UgwrcFjLUmPZPiCep614AaABAg,@mawardewia,UCrc-pOM4nSykGf2arSyGBoQ,13:35 pro suhoo,0,2024-09-24T14:02:24Z,,0
BfsVafvcQ4k,Ugx_tshIdCwvd3WP1Jl4AaABAg,@acacia522,UC1LysN0c4QKDnU1002psFvQ,I witnessed his solo concert once and it was the best time of my life 😊 i miss him already!,19,2024-09-24T14:02:14Z,,0
BfsVafvcQ4k,UgydqFLZhZw_YyAiZEZ4AaABAg,@eriyah_L1485,UCwlixDNQTldKn0a1AaoMOWw,"I Love you too forever you are mine too, saranghaeyo leadernim oppah🐰 ❤❤❤❤",4,2024-09-24T14:00:51Z,,0
BfsVafvcQ4k,UgxWXq6psvBEzfPME814AaABAg,@SanpalOo-h1k,UChP8FQsVGoBglh-uJst2UUQ,"Thank you so much Oppa for everything. Always with you, Oppa. Forever is ours. We will always be together with mutual love and truth. Thank you so much Oppa for everything. Suho Oppa gives us positive energy.",13,2024-09-24T13:59:35Z,,0
BfsVafvcQ4k,UgyAnqUqLslfP3GLcIp4AaABAg,@lannimariani8308,UCzXhIn-5sLIzQ2A8IC7-lIQ,You are so handsome with long hair..love u junmyeon ❤,1,2024-09-24T13:59:25Z,,0
BfsVafvcQ4k,UgxcXlWJttEtpJ4vcPZ4AaABAg,@따따ddadda,UCYHsUyNjQCvdyvKaUKmgqPg,너무 예쁘다 준면아 수고했어🩷,2,2024-09-24T13:55:40Z,,0
BfsVafvcQ4k,UgyQPnQz3oSHrLtpzKN4AaABAg,@ririnratna9793,UC9z_KBDjlLLKGC6OodIszww,"Our precious leader, Junmyeona... I miss you so much, we love you so much ❤",8,2024-09-24T13:55:28Z,,0
BfsVafvcQ4k,UgzvJ_Vq63u636cZehR4AaABAg,@summersunshine242,UCrXDBJHS0unHsND-a24xBwg,I miss Suhome so badly 😭,3,2024-09-24T13:54:42Z,,0
BfsVafvcQ4k,UgxM8TV7A6K6DxbRUmN4AaABAg,@ibexo99,UCZtIVrE3Iv1anh42yZk_IrQ,Big love you JUNMYEON 🥺🥺🤍🤍🤍🤍🤍,6,2024-09-24T13:53:48Z,,0
BfsVafvcQ4k,UgzMKLeyeyNlcxOAVjN4AaABAg,@swing0522,UC-ap0ifrQydj1NHBP9YQlLg,"우와...... 나다...............😂
카감님이 응원봉만 찍으신 줄 알았는데...🫢",1,2024-09-24T13:53:09Z,,0
BfsVafvcQ4k,UgwhaLAUlaQmUo9RPRR4AaABAg,@lauriegonzalez2374,UCVK0cjxUSFCU5IwMsJOLinw,"So disappointed that we didn't get to know why the European Tour was canceled...in the end International fans are nothing for those companies??no consideration...i don't even remember SM posting an apology about it...yeah...we are nothing for them...the only thing i know for sure, is that Suho was, as disappointed as we were...i don't even know if i'll have the strength to try again if they announce new dates in 2025...but for sure, i don't trust SM anymore...",2,2024-09-24T13:52:56Z,,4
BfsVafvcQ4k,UgwhaLAUlaQmUo9RPRR4AaABAg.A8lqv0vGF0AA8nY-T8Ragt,@lovingmyselfright,UCJzIkwuUQYCwFLjVfIWGixg,Why was it cancelled? What do you think the reason could be?,0,2024-09-25T05:37:23Z,UgwhaLAUlaQmUo9RPRR4AaABAg,0
BfsVafvcQ4k,UgwhaLAUlaQmUo9RPRR4AaABAg.A8lqv0vGF0AA8naj0A79Rl,@lauriegonzalez2374,UCVK0cjxUSFCU5IwMsJOLinw,"@@lovingmyselfright no idea...but again, people lost money...",0,2024-09-25T06:09:57Z,UgwhaLAUlaQmUo9RPRR4AaABAg,0
